comment_id,note_key,user_key,user_name,user_urlname,user_icon,commented_at,body
nc7b864fb49b9b,nac392eeadc12,e8a8d7772c1aae2b688fec203c1903dd,MaRu（まる）｜ 4時起き朝活ワーママ,jolly_gerbil573,https://assets.st-note.com/production/uploads/images/263795679/profile_286a7a9d12b529deb20a75cfae67120b.jpeg?fit=bounds&format=jpeg&quality=85&width=330,2026-04-03T20:03:59.071+09:00,"よしひろさん、こんばんは！
note1周年、おめでとうございます✧︎*。

軽やかに見えて、この一年の積み重ねがちゃんとにじんでいて素敵ですね◎
これからも楽しみにしていますஐ:*"
nc2c670ce22e98,nac392eeadc12,685d473fa4f471b5b9f52de0d570a2f0,さとりのさとり,kopailog,https://assets.st-note.com/production/uploads/images/226182676/profile_094199e7fa1bff58de5da5e07a1a43de.png?fit=bounds&format=jpeg&quality=85&width=330,2026-04-03T19:00:57.618+09:00,"おめでとうございます✨

noteはじめたの
よしひろさんの方が
2カ月ほど先輩ですね😊

これからもよろしくお願いしますね🙇"
ncb52b0de69955,nac392eeadc12,62682d94f2f4d5e27cfc09d513e2be31,五十嵐雉虎（イガラシ・キジトラ）｜準文筆家｜掌編小説・ショートショート作家,kijitora50storm,https://assets.st-note.com/production/uploads/images/177475360/profile_590d0419ed4a65e554de7e8288c064e4.png?fit=bounds&format=jpeg&quality=85&width=330,2026-04-03T18:12:24.751+09:00,"1周年おめでとうございます。
私は明日（4月4日）で丸1年です。
1日遅れて着いていきます！"
nc41d6ca394a5a,nac392eeadc12,15b07889aa53dbf10c9cb1b67625f4b4,rika🌷,meina_rikamizuki,https://assets.st-note.com/production/uploads/images/238910767/profile_373a9816961e0c2decd5f9e33be51347.png?fit=bounds&format=jpeg&quality=85&width=330,2026-04-03T18:07:30.845+09:00,"よしひろさん、1年おめでとうございます🎉✨️

一緒に１年を迎えられて嬉しいです☺️✨
もうグアムから帰ってきたかな？
土日はゆっくり過ごしてくださいね🌷✨️"
nc78b0b67976e5,nac392eeadc12,3230acd73a454345c25d7cc7da2fd8b8,AYU,ayu760,https://assets.st-note.com/production/uploads/images/124260230/profile_7da754e5114659f81ebeca7786de3b0d.jpeg?fit=bounds&format=jpeg&quality=85&width=330,2026-04-03T16:41:03.307+09:00,"よしひろさん✨こんにちは😊

㊗️note1周年おめでとうございます！！🎉🎉✨✨

これからも､よしひろさんの記事を楽しく読ませていただきますね！！😊✌️✨"
nc6cb44094471d,nac392eeadc12,24ae8442856f6e3b72ae8eee40690c51,Mie,genial_cat129,https://assets.st-note.com/production/uploads/images/259954001/profile_5d311f6904fdf72781a68dbd8a987133.png?fit=bounds&format=jpeg&quality=85&width=330,2026-04-03T15:14:17.220+09:00,"よしひろさん
こんにちは♪
一周年おめでとうございます🎉
やっと一息ついてスマホを見たら
この記事に辿り着きました。
心からお祝い申し上げます🥂
noteを始めてから半年よしひろさんの記事で
ほっと一息つく時間をいただき
慌ただしい日々を駆け抜けてきました。
これから先ももっと時間の流れは早く
過ぎてしまうのでしょう。
それでも小さな幸せをひとつひとつ大切に
集めて宝物にしていきたいと思います。
よしひろさんとご家族の健やかで穏やかな日々が
続くことを心から願う５５歳おとめ座でした。
ありがとうございます♪"
nce3dacc5c3f1f,nc93b3230f5a2,d0c5765a47753e17543a7b9179cf317e,m o k a   ,crisp_rabbit1664,https://assets.st-note.com/production/uploads/images/244970963/profile_70498c82f9b680f43cff864d5947e3da.jpeg?fit=bounds&format=jpeg&quality=85&width=330,2026-04-13T14:11:54.205+09:00,"よしひろさん

グアム旅行のお話
色々な景色やお店 や食べ物などの
写真やお話 楽しかったです♪

ご家族　娘さんにとっても
貴重な体験と時間になったかな♡

写真　たくさんのシェア
ありがとうございました♪
"
nce80f2f322820,nc93b3230f5a2,f70038deb9c5f3f87c2ee7969a2cf523,不屈の屈葬,fukutsunokussou,https://assets.st-note.com/production/uploads/images/228082209/profile_bc2555e2c34c9857d7b2291bb9e9cc80.png?fit=bounds&format=jpeg&quality=85&width=330,2026-04-04T15:50:16.773+09:00,"お疲れ様でした～！
お子様たちもいい経験を積んでレベルアップしたでしょうね～！
楽しんでいた様子が伝わりました！

…にしても毎記事おいしそうでした（笑）"
nc840f7ff0bbfb,nc93b3230f5a2,685d473fa4f471b5b9f52de0d570a2f0,さとりのさとり,kopailog,https://assets.st-note.com/production/uploads/images/226182676/profile_094199e7fa1bff58de5da5e07a1a43de.png?fit=bounds&format=jpeg&quality=85&width=330,2026-04-03T18:58:32.723+09:00,"よしひろさん、お疲れ様でしたー😆
あっという間でしたね💨

時間って
なんでこんなに早いんでしょうね

準備から帰国まで
楽しませていただきました✨

ゆっくり休んでくださいね😊"
nc27ad29f82178,nc93b3230f5a2,12ef2d2180f9d3f754c7808c3befca1a,kinako,serene_tiger1435,https://assets.st-note.com/production/uploads/images/265260836/profile_44559427678c4fb54aa9d1e8f91ba4af.png?fit=bounds&format=jpeg&quality=85&width=330,2026-04-03T15:33:25.010+09:00,"よしひろさん、おかえりなさい🌟
たくさんの写真で、リゾートの雰囲気を感じさせてもらいました🌴🌊✨
癒しをありがとうございました〜😊

"
ncc76819c347c6,nc93b3230f5a2,d58df56d72e51835fa8597640954d50b,道草ノート🌿ゆう,koya1970,https://assets.st-note.com/production/uploads/images/239663389/profile_49bb32f5cdb12b8a92a46112d883daf1.png?fit=bounds&format=jpeg&quality=85&width=330,2026-04-03T06:55:31.467+09:00,"よしひろさん
おはようございます☀
毎日楽しく拝見していました☺️只今6:54今頃機内かな？と想像しながら…🤭
お話の続きを楽しみにしています♪"
nc76a47351d371,n0433743c1f38,f19d138b5f57bc35ca0f56f51ab37ac5,りーまむ,ri_mam,https://assets.st-note.com/production/uploads/images/186523962/profile_939af6d936ad6ca5456ee55e7d9d6404.jpeg?fit=bounds&format=jpeg&quality=85&width=330,2026-04-07T15:37:54.535+09:00,"グアムなつかしい〜🇬🇺
恋人岬も行ったなぁ

それにしても、サムネイルのこんな使い方があるなんて、斬新✨"
nc8a2d74ca83aa,n0433743c1f38,c068f7865d8e0da6555ec8d5b896bf89,くすり。。,crystal_shine,https://assets.st-note.com/production/uploads/images/236251541/profile_ab33998a42f921a3d102004f1dc24467.png?fit=bounds&format=jpeg&quality=85&width=330,2026-04-03T14:06:20.699+09:00,"よしひろさん

こんにちは☀️
空がめちゃくちゃ綺麗でした✨
パソコンで見ると、雲が物凄く立体的に映りました☁️

もう一度、前の記事からさかのぼって見てみました。
スマホは虹や海が映える🌈
パソコンは空が映える。
私には、そんなふうに映りました🍀

同じ画像でも、見るものでこんなにも違うんだということが、
よしひろさんの旅行記を見て感じましたよ✌️

パソコンでもスマホでも、見比べる楽しみを知りました😉
同じ記事を二度楽しめました♬

もしよかったら、見比べてみてくださいね🌟
"
ncdb7968b62e6b,n0433743c1f38,907edc26ecc556b380bd733caf94e5cc,JAU |  臨床検査技師×医療副業,jau_jau1001,https://assets.st-note.com/production/uploads/images/238898866/profile_b47389bc5953cb4d37cf45a1d4d208c2.png?fit=bounds&format=jpeg&quality=85&width=330,2026-04-03T10:37:03.154+09:00,私もそのパンツ欲しいです🤣✨w
nc6f9b61ff75ba,n0433743c1f38,83e5f78b9b7b83fe911db049b95a1d27,えびしま| AI×noteで生活に余白をつくる,emi_dh,https://assets.st-note.com/production/uploads/images/243764210/profile_e472159630049af76169c820dc45c9cb.png?fit=bounds&format=jpeg&quality=85&width=330,2026-04-02T19:28:36.488+09:00,"よしひろさん🌺
まとめ読みしておりますが、ゲリラ更新に追いつきました😆
グアム楽しいですね⇦行ってない笑。記事見ているとワクワクしてきます✨美味しそうなもの海や現地のお店。写真もたくさんで現地の様子が伝わってきます✨"
nc540da7e6fe88,n7be657636025,73ee01c7e2de034c5a175d026421c266,スイカの子,merry_sorrel8816,https://assets.st-note.com/production/uploads/images/243607727/profile_6c9abdd12417168840b7c0f2ef6772ab.jpeg?fit=bounds&format=jpeg&quality=85&width=330,2026-04-02T12:53:11.125+09:00,"よしひろさん、こんにちは！

無事に行けて良かったです🙌
たくさん写真載せてくれてるから私も一緒に行ってる気分〜🤭
外国に行った事がない私（あまり行きたいと思わない）も、あーいいなーってなっちゃいました😆！
美味しそう♡楽しそう♡"
nca244f392b187,n7be657636025,52696bea4573ce2aadd076e75b0baa4a,なな,nana_155,https://assets.st-note.com/production/uploads/images/263366995/profile_bf7f72d072d2c70ac8129d90527a5de1.png?fit=bounds&format=jpeg&quality=85&width=330,2026-04-01T23:37:14.129+09:00,"サムネイルの並びに、思わずほっこりしました✨
さりげない遊び心がとても素敵だなと感じました😊

グアムの旅行記も、いつも楽しみに拝見しています🦋"
nc21ac2467bf8c,n7be657636025,32a3d5ec7b1b7751c0635f2e47ea2b11,あん｜noteと遊ぶ,aging_gracefully,https://assets.st-note.com/production/uploads/images/238258843/profile_52f43522d9e7e75a12acd9d6da59035c.png?fit=bounds&format=jpeg&quality=85&width=330,2026-04-01T21:18:44.633+09:00,"ドルで買い物、いい経験ですよね〜
いい思い出ができたんじゃないですかね🫶"
ncd1f8b8195986,n7be657636025,aefdbe2c616c4952074a5fb37ae88b60,かなハム,himawarino86,https://assets.st-note.com/production/uploads/images/170523869/profile_2e298a41cb0d68341ce03fb1a8ad5bb7.jpg?fit=bounds&format=jpeg&quality=85&width=330,2026-04-01T07:22:27.956+09:00,"最後のバナナにほっこりしました🍌
知らない間にスタッフが置いてくれてあったんですか😅"
nc222195fd5d13,n7be657636025,685d473fa4f471b5b9f52de0d570a2f0,さとりのさとり,kopailog,https://assets.st-note.com/production/uploads/images/226182676/profile_094199e7fa1bff58de5da5e07a1a43de.png?fit=bounds&format=jpeg&quality=85&width=330,2026-04-01T06:08:49.741+09:00,"あ、すご
クリエイターページから見ると
面白いことしてますね😆

ちょっとこれから一気に読みますねー"
nc17b2db211c9b,n9ffd45a4777c,a3b393748448993682c446017554f28a,りこ@一生養生,riko_83,https://assets.st-note.com/production/uploads/images/242853208/profile_868cf0850d54d0a98ca0406d82454cfa.png?fit=bounds&format=jpeg&quality=85&width=330,2026-04-01T11:01:51.862+09:00,"こんにちは☀
盛りだくさんですね😊🍀
とっても楽しそう🎵
お土産はこんがり日焼けしたキティちゃんが良いなぁ（笑）"
nc8922418f91dd,n9ffd45a4777c,3a07bbf39f62dca69a000064efb4f859,ゆまま｜世帯年収400万で年間100万貯金をする主婦,noble_hare4289,https://assets.st-note.com/production/uploads/images/268073236/profile_2851b9702b1e202f0607cd443ad927e3.png?fit=bounds&format=jpeg&quality=85&width=330,2026-03-31T21:33:43.372+09:00,"可愛すぎるマカロンに🌈虹に。
🚌でお買い物、プール
ほんと毎日楽しそうで、
やっぱり羨ましいです。
いつか行きたいなーと
ワクワクしながらみてしまいます。
リアルとってもうれしいです！

ウィスキーないなんて、そんなこと
あるんですね🤭
明日も楽しみです😊"
nc64ee5a9516ee,n9ffd45a4777c,0793b040bdb88db471f3f31c70126567,あやい～,long_thyme4807,https://assets.st-note.com/production/uploads/images/243852262/profile_896d5af92901355e5f14916fab7a9520.jpg?fit=bounds&format=jpeg&quality=85&width=330,2026-03-31T18:25:19.935+09:00,"わぁ、すごく充実したグアム旅行ですね！🌴
写真から楽しさが伝わってきます😆
リアルタイムで更新してくれるのも嬉しいです✨
続きも楽しみにしています！"
nc33eb82eb0c83,n9ffd45a4777c,24246d30e5c0e48fb501516abf0f7a1d,風光明媚,keen_otter4172,https://assets.st-note.com/production/uploads/images/263281955/profile_13246f79de604a3606b24a1c925d831b.jpg?fit=bounds&format=jpeg&quality=85&width=330,2026-03-31T18:01:05.800+09:00,"グアム旅行、楽しそうですね！朝の虹や鶏の声、そしてステーキの話がとても魅力的でした。
家族旅行ならではのゆったりした雰囲気が伝わってきて、こっちまでリラックスできました。
旅行中に気になることとして、タクシーアプリ（stroll）を使ったとのことですが、現地でタクシーアプリを使う際の便利な点や注意点について、もう少し詳しく教えていただけますか？"
nc84e68d59e146,n9ffd45a4777c,15b07889aa53dbf10c9cb1b67625f4b4,rika🌷,meina_rikamizuki,https://assets.st-note.com/production/uploads/images/238910767/profile_373a9816961e0c2decd5f9e33be51347.png?fit=bounds&format=jpeg&quality=85&width=330,2026-03-31T11:19:02.939+09:00,"メッチャ満喫してますね✨️
朝ごはんのドーナツ🍩いーなー！！
美味しそうです😋
プール👙もビーチも楽しそうで、お子さんも元気そうで良かったです🌷✨️"
ncc1e50f35b30f,n9ffd45a4777c,32a3d5ec7b1b7751c0635f2e47ea2b11,あん｜noteと遊ぶ,aging_gracefully,https://assets.st-note.com/production/uploads/images/238258843/profile_52f43522d9e7e75a12acd9d6da59035c.png?fit=bounds&format=jpeg&quality=85&width=330,2026-03-31T09:37:39.253+09:00,"サムネが！
こうゆうの好きです😊"
ncf83f6488bbbb,n7699591bc882,1855ab43007be46a347e898053d57368,Viola,viola9836,https://assets.st-note.com/production/uploads/images/152908817/profile_5559a313443730e2c26f44c056f1ba4c.jpeg?fit=bounds&format=jpeg&quality=85&width=330,2026-04-03T18:44:47.912+09:00,"お食事がとても羨ましいです。
ヨーロッパのコンチネンタルブレックファーストは大抵どこもシンプルで、あまり皆さん食べません。
お料理を拡大してじっくり拝見しました🤭

ハワイやグァムって、楽しいですよね〜
私までご機嫌な気分にさせていただきました。

"
nc324844c75164,n7699591bc882,3a07bbf39f62dca69a000064efb4f859,ゆまま｜世帯年収400万で年間100万貯金をする主婦,noble_hare4289,https://assets.st-note.com/production/uploads/images/268073236/profile_2851b9702b1e202f0607cd443ad927e3.png?fit=bounds&format=jpeg&quality=85&width=330,2026-03-30T20:29:47.951+09:00,"よしひろさーん
二日目の楽しいグアムのご様子🩷
ありがとうございます。
朝からお風呂に🌈いいですね
お子様たちの心にもきっとずっと
ずっと残りますね
21年前の新婚旅行の事を思い出し
ながら🤭
懐かしいなーと思いました。
また楽しみにしています"
nca03c2ccb2bd8,n7699591bc882,907edc26ecc556b380bd733caf94e5cc,JAU |  臨床検査技師×医療副業,jau_jau1001,https://assets.st-note.com/production/uploads/images/238898866/profile_b47389bc5953cb4d37cf45a1d4d208c2.png?fit=bounds&format=jpeg&quality=85&width=330,2026-03-30T17:57:17.586+09:00,"良い景色ですね〜👏✨
しかもウイスキーあるじゃないですか🤩w

ぜひ！ご家族で満喫してきてくださいね🥳
また、ご報告お待ちしています😆"
ncdc760947c891,n7699591bc882,f70038deb9c5f3f87c2ee7969a2cf523,不屈の屈葬,fukutsunokussou,https://assets.st-note.com/production/uploads/images/228082209/profile_bc2555e2c34c9857d7b2291bb9e9cc80.png?fit=bounds&format=jpeg&quality=85&width=330,2026-03-30T17:33:29.774+09:00,"満喫してますね〜！
食事も異国感溢れますがめっちゃ美味しそう！！
引き続きご家族でお楽しみくださいませ！
"
ncd6b4bc78afd8,n7699591bc882,c068f7865d8e0da6555ec8d5b896bf89,くすり。。,crystal_shine,https://assets.st-note.com/production/uploads/images/236251541/profile_ab33998a42f921a3d102004f1dc24467.png?fit=bounds&format=jpeg&quality=85&width=330,2026-03-30T08:51:10.106+09:00,"よしひろさん

おはようございます☀
初めての海外旅行いいですね👍

もう、色んなものが画面から伝わってきます✨
虹と海と青空と。
あの画像を見た瞬間に、
「おー！」
と、声が出ました✨
感動です🌈

どこでもドア🚪
欲しい…

更新楽しみにしています♬
思いっきり、楽しんできてくださいね🌸

写真いっぱい、
海いっぱい見たいな☺️


ふふふっ。
私も、コメント更新しちゃう〜🍀
「きゃ〜」
海に心を奪われました💖
青空も、素敵✨✨

私は、海が大好き❤
どこでもドア〜🚪"
nc84bcaba48c3e,n2ffb06432f1f,d0c5765a47753e17543a7b9179cf317e,m o k a   ,crisp_rabbit1664,https://assets.st-note.com/production/uploads/images/244970963/profile_70498c82f9b680f43cff864d5947e3da.jpeg?fit=bounds&format=jpeg&quality=85&width=330,2026-04-12T15:30:10.151+09:00,"よしひろさん

マガジン追加
ありがとうございます✨️

旅行記事 ゆっくりと
読ませていただきます(˶´ᵕ`˶)

ありがとうございました♡"
nc868091fcf22d,n2ffb06432f1f,1855ab43007be46a347e898053d57368,Viola,viola9836,https://assets.st-note.com/production/uploads/images/152908817/profile_5559a313443730e2c26f44c056f1ba4c.jpeg?fit=bounds&format=jpeg&quality=85&width=330,2026-04-03T18:37:27.388+09:00,"連続のヘッダー画像がお見事です。
人の旅の様子を拝見するのって楽しいです。
よしひろさんらしいお洒落旅ですね♪
お荷物がすでにまとまっていてお洒落。
我が家は車の旅行の上、犬のバギーやトイレも持参しますので、スーツケース以外にもゴチャゴチャいろいろ持って行きます。"
nc1137db096454,n2ffb06432f1f,7166c7787e1efaa17147ad78e5878f9d,栗野こーぎぃ,tomoka_takeura,https://assets.st-note.com/production/uploads/images/265446311/profile_7b591e9509f8d7b45de2ac55b678726e.png?fit=bounds&format=jpeg&quality=85&width=330,2026-03-29T16:22:24.890+09:00,無事出発でき、まずは良かったですね😆楽しんでください🌴
nc27f034c1cf79,n2ffb06432f1f,3a07bbf39f62dca69a000064efb4f859,ゆまま｜世帯年収400万で年間100万貯金をする主婦,noble_hare4289,https://assets.st-note.com/production/uploads/images/268073236/profile_2851b9702b1e202f0607cd443ad927e3.png?fit=bounds&format=jpeg&quality=85&width=330,2026-03-29T15:46:35.158+09:00,"わあ〜とうとうですね！
リアル楽しみにしてます💕💕
美味しいウイスキー🥃に
出会えるといいですね
ご家族さまと素敵な素敵な
旅になりますね✨
"
ncb5fbf93fe0ad,n2ffb06432f1f,15b07889aa53dbf10c9cb1b67625f4b4,rika🌷,meina_rikamizuki,https://assets.st-note.com/production/uploads/images/238910767/profile_373a9816961e0c2decd5f9e33be51347.png?fit=bounds&format=jpeg&quality=85&width=330,2026-03-29T11:46:07.853+09:00,"わー！！！
凄い凄い(•ө•)♡
更新楽しみにしてますね😆
楽しんできてください〜✨️"
nc5a8bb26b8bc4,n2ffb06432f1f,a3b393748448993682c446017554f28a,りこ@一生養生,riko_83,https://assets.st-note.com/production/uploads/images/242853208/profile_868cf0850d54d0a98ca0406d82454cfa.png?fit=bounds&format=jpeg&quality=85&width=330,2026-03-29T10:20:31.271+09:00,"こんにちは☀
更新楽しみにしています🌈
道中お気をつけて😊
行ってらっしゃい🍀"
nc375efafc6903,n2ffb06432f1f,907edc26ecc556b380bd733caf94e5cc,JAU |  臨床検査技師×医療副業,jau_jau1001,https://assets.st-note.com/production/uploads/images/238898866/profile_b47389bc5953cb4d37cf45a1d4d208c2.png?fit=bounds&format=jpeg&quality=85&width=330,2026-03-29T10:19:06.674+09:00,よしひろさん〜！お気をつけていってらっしゃーい👋✨
nca658746880ed,n2ffb06432f1f,9735e1bac7ba0bc5d0af33cf56157b08,enyo*えんよう🗝️,keyoflife_enyo,https://assets.st-note.com/production/uploads/images/240644209/profile_1ac1d8614044bc9c45db88b11d02d8f6.png?fit=bounds&format=jpeg&quality=85&width=330,2026-03-29T10:05:04.443+09:00,"よしひろさん
お気をつけて＆楽しんできて下さい✈️ Bon voyage🏖️✨
"
ncbbd70a7a1af4,n6e2623320b07,8bf11e31ed6c2d484ddc7eea63ea837a,see2,chic_badger5419,https://assets.st-note.com/production/uploads/images/250889396/profile_33517a4ff74c2ffd00d328298ad11555.png?fit=bounds&format=jpeg&quality=85&width=330,2026-03-30T23:20:54.256+09:00,"よしひろ様

こんばんは！
私も繊維＆輸出入関係の会社で働いていたことがあり、
番手が懐かしいです💕生地のスワッチとかあったなぁ…。
鎌倉シャツさん素敵ですよね。"
nc43e20938d7a9,n6e2623320b07,eed5ecfed107018ad2e3babae2da426b,TOMOTAN .,tomopon0358,https://assets.st-note.com/production/uploads/images/212045661/profile_59debc1ddc8761c43473bc773d86f2a3.png?fit=bounds&format=jpeg&quality=85&width=330,2026-03-28T23:35:58.097+09:00,"夫と息子は体型が似ていて、
夫は180cm、息子は178cm、
2人とも手足が長く、首が細いです。

市販のシャツやスーツは合うものが
ほとんどありません。

春から大学生の息子も、夫がオーダー
するセレクトショップでスーツを作り、
1枚はタブカラーも購入しました。

塾のバイトもスーツ着用なので、何着か
カラーを変えて購入しましたが、スーツを着ると男性はやっぱり良いですね！！

シャキッとして見えます✨

いつもマガジン追加
ありがとうございます！！"
nc0d448092f900,n6e2623320b07,82dd8717325a4e053e7ff44328dc343e,こみ,eager_pothos5160,https://assets.st-note.com/production/uploads/images/252617188/profile_69ef9a002680c34accae10879d9ef09e.png?fit=bounds&format=jpeg&quality=85&width=330,2026-03-28T22:56:42.237+09:00,"楽しく拝読しました❗️

400番手のシャツ、一度袖を通したら普通のシャツに戻れなくなりそうで、怖くて手が出せないです👀

2年前でそのお値段……💦現在の価格表を見るのが少し怖くなるほどですが、あの光沢にはそれだけの価値がありますよね。

ちなみに冬の重厚なツイードに合わせるウールシャツや、夏を乗り切る綿麻も、鎌倉シャツのオーダーなら間違いのない選択肢としておすすめですよ❗️"
nc35a8f62f61a3,n6e2623320b07,32a3d5ec7b1b7751c0635f2e47ea2b11,あん｜noteと遊ぶ,aging_gracefully,https://assets.st-note.com/production/uploads/images/238258843/profile_52f43522d9e7e75a12acd9d6da59035c.png?fit=bounds&format=jpeg&quality=85&width=330,2026-03-28T22:56:08.505+09:00,"よっしーさん
気をつけて行ってらっしゃいませ💫

白シャツってあまり着なくてもお手入れ難しいですよね、、"
nc548f9de261a9,n8f85d90473a4,1855ab43007be46a347e898053d57368,Viola,viola9836,https://assets.st-note.com/production/uploads/images/152908817/profile_5559a313443730e2c26f44c056f1ba4c.jpeg?fit=bounds&format=jpeg&quality=85&width=330,2026-04-03T18:31:35.648+09:00,"よしひろさん
旅記事を早速マガジンに追加していただき、ありがとうございます。前回、旅行の途中でお礼をお伝えしていなくて、大変失礼しました🙇‍♀️

Vは生涯お人形たちを大事にし続けます☺️
本当に自分にとって必要な物とは、案外ごく僅かですよね。

旅行から帰ってくると、改めて感じた事の多さを実感します。
旅の価値は「知ること、気づくこと」に尽きるのではないかと今回思いました。
年齢を重ねるごとに、旅で感じることが増えるように思います。"
ncb7bb9f59c881,n8f85d90473a4,4538b1bf2bc68bad9b44ee65b925e8d7,月花の雫 | 明日ってさ、月が欠けたら来ないよね～　人生の夜を照らすお供に,shiso_to_basil,https://assets.st-note.com/production/uploads/images/245061439/profile_d9fc767d436db3f445735f3499e44dea.jpg?fit=bounds&format=jpeg&quality=85&width=330,2026-03-28T22:06:47.078+09:00,"私は、圧倒的に、物より体験派だなぁ
ただこれは、”付き合い”で消えるお金は入らないけど

自分がやりたくてすること、と、自分が欲しくて（必須なものは別）買うもの、
お金の使い道でどちらかしか選べなかったら、絶対前者を選ぶ

ただ、両方に関わる”食べ物”が、どっちにカテゴリー分けされるかで
私の答えはちょっと揺らぐかも知れない（笑）
"
nc5aad3696ae41,n8f85d90473a4,290f76d99eb40b676ce764b1c2a200e3,Takanashi（たかなし）,takanashi_note01,https://assets.st-note.com/production/uploads/images/235786177/profile_d3248e02f9810e16a0daf3e4a02bee0b.png?fit=bounds&format=jpeg&quality=85&width=330,2026-03-28T14:24:52.179+09:00,"形に残る＝それを収納、あるいは展示するスペースが必要になるということですからね。
現在電子書籍が急激に普及しているのも、スペースの問題が大きいのではないかと思います。
たとえ形に残らなくても、記憶の中にしっかり残る経験であれば、個人的にはその方が価値が高いのではないかな？　と思いました。"
