comment_id,note_key,user_key,user_name,user_urlname,user_icon,commented_at,body
nc9cfd5ad4d493,n870c3b1043b8,1855ab43007be46a347e898053d57368,Viola,viola9836,https://assets.st-note.com/production/uploads/images/152908817/profile_5559a313443730e2c26f44c056f1ba4c.jpeg?fit=bounds&format=jpeg&quality=85&width=330,2026-03-13T00:24:57.572+09:00,"よしひろさん
マガジンへの追加をしていただき、ありがとうございました🙇‍♀️

旅行へ行くといつも思うこと。ヨーロッパでは一般のホテルはアメニティを置いていないところが殆ど。お洒落なフランスのホテルでも皆無です。
ホテルには日本のような売店もないので、うっかり切らすと大変。
東欧の国は日本並みに置いてあります。
また、個人経営の何部屋か貸しているような小さいホテルの方が、ずっと快適であったりします。

ただ手洗い用とボディーソープ、シャンプーを兼用のものだけはどこでもあって、うちのOはそれで全然平気なタイプ。
用途が違うのだから、私のを使えば?と言ってもそれで平気。
あれで平気なら楽だろうなといつも思いますが、様々な用途にある程度対応する成分のせいか、手洗いだけでもなかなか洗い流せずヌルヌルしますので、私はハンドソープも持っていきます。
犬の足もそれで洗ってさっぱり。

お洒落な人にはあれ1本で済ますなんて考えられないですよね〜🤭"
ncf842258ec918,n870c3b1043b8,a790aa624dded68d048acf235b85cc3c,柴わんこ,shibawaka555,https://assets.st-note.com/production/uploads/images/238902723/profile_e9480392b9cdfa2e109591cf8bd585ee.png?fit=bounds&format=jpeg&quality=85&width=330,2026-03-12T14:31:11.951+09:00,よしひろさん、こんにちは！記事の紹介と、よしひろさんの考え、ありがとうございます✨自分の気分を上げる方法としてのスキンケア、いいですね🎵ちょっと丁寧にやると、私も気分あがります😊改めて、私の記事でご紹介させてください！
nc24deeb8d8e90,n870c3b1043b8,32a3d5ec7b1b7751c0635f2e47ea2b11,あん｜noteと遊ぶ,aging_gracefully,https://assets.st-note.com/production/uploads/images/238258843/profile_52f43522d9e7e75a12acd9d6da59035c.png?fit=bounds&format=jpeg&quality=85&width=330,2026-03-12T12:40:31.657+09:00,"なんとスキンケア💞
ありとあらゆることを試してきました🤣
シンプルケアがいちばんですね"
nc2a0bb800b696,n326c0c4fb634,c068f7865d8e0da6555ec8d5b896bf89,くすり。。,crystal_shine,https://assets.st-note.com/production/uploads/images/236251541/profile_ab33998a42f921a3d102004f1dc24467.png?fit=bounds&format=jpeg&quality=85&width=330,2026-03-15T09:52:33.438+09:00,"よしひろさん

こんにちは☀️
おしゃれなバーで、おいしいウイスキー🥃✨
もう、うらやましいすぎます💖

私が初めておいしいと思ったウイスキーは、確か記憶では、バランタイン１７年です。
でもね、もうどんな味かも忘れてしまいました💦

うんと、わか〜い時の話です。
また、機会があれば飲んでみたいと思います♬
あの頃と同じように、おいしいと思えるかしら？"
nca8796f0a0bc2,n326c0c4fb634,907edc26ecc556b380bd733caf94e5cc,JAU |  臨床検査技師×医療副業,jau_jau1001,https://assets.st-note.com/production/uploads/images/238898866/profile_b47389bc5953cb4d37cf45a1d4d208c2.png?fit=bounds&format=jpeg&quality=85&width=330,2026-03-12T22:18:50.984+09:00,"ウイスキーネタきた〜！w
よしひろさん！こんばんは✨

オールドバランテュラン👏
またオシャレなの飲んでますね！スペイサイドでは珍しいピーティですね🤩
これは、私も飲みたい〜😭✨w

ラガヴーリン16年は、数年前は7〜8000円くらいで買えましたが、1番値上がり幅がヤバかった記憶があります！たしか、今は倍の16000円以上💦家にストックはキツいですね🤣w

よしひろさんの画像でブルックラディのポートシャーロットがありますが、これはとても特徴的な風味があり、日本の出汁の風味があるので意外と面白いウイスキーかと✨私は好きです❣️

長文失礼しました〜😅w"
nc1fc71bcb64b6,n326c0c4fb634,bede9bd0a510b6a3b89dcb460dd51ef5,ルルトアヤコ,lovely_coyote546,https://assets.st-note.com/production/uploads/images/264394551/profile_7d53e99488d218760c7f91157493e91b.png?fit=bounds&format=jpeg&quality=85&width=330,2026-03-12T05:33:47.850+09:00,"よしひろさん、いつもさりげなくマガジンに追加ありがとうございます💖💖💝

私…ウイスキー🥃、全くの音痴ですね。
知らないだけで…

でも、よしひろさん、流石…お味の説明の仕方が、わかりやすくて…良いですね♪お仕事柄？

noteにも役立つし、良いなぁって思います♪"
nc3b14fa468e9e,n326c0c4fb634,a8ca38d524e2e730de4dccde3a1ef626,かいと@酒と魚好き,like_camel7475,https://assets.st-note.com/production/uploads/images/237563841/profile_e128a3d230e7682ca44b23e6a5f849c5.jpg?fit=bounds&format=jpeg&quality=85&width=330,2026-03-12T01:17:34.640+09:00,"よしひろさん
いつもマガジン追加ありがとうございます！

新しいお酒の出会いいいですね😊
僕も冒険していつもと違う感じを
味わいたくなりました😋"
ncc80cc8f49169,n326c0c4fb634,9735e1bac7ba0bc5d0af33cf56157b08,enyo*えんよう🗝️,keyoflife_enyo,https://assets.st-note.com/production/uploads/images/240644209/profile_1ac1d8614044bc9c45db88b11d02d8f6.png?fit=bounds&format=jpeg&quality=85&width=330,2026-03-12T00:46:13.618+09:00,"よしひろさん

マガジン追加、ありがとうございます！

私はワイン派でウイスキー🥃には疎いのですが、外食の際は、飲んだ事のないものを選ぶ""ワイン探訪""をしています♪「まだ知らない好き」だらけです🍷😊
"
nc121e56546bc3,n326c0c4fb634,b39624e9464ededa053a7cbf0de179ce,あな,ana_mama_english,https://assets.st-note.com/production/uploads/images/219621833/profile_8ef662d95d545fc74251b7700219beae.png?fit=bounds&format=jpeg&quality=85&width=330,2026-03-11T21:54:42.502+09:00,"よしひろさん、こんばんは⭐︎

マガジン追加とスキをいただき、
ありがとうございます☺️

「今日は探検の日」や
「まだ知らない好き」に出会える瞬間、
すてきですね☺️
私も、好きを大事にするだけでなく
探検することも楽しんでいきたいです♪
"
nc61a19f12b457,n6d0edf9289fa,8f6ffb8eddcfd0b83e06e8eb31606ca8,Old Man Mike,unclemike,https://assets.st-note.com/production/uploads/images/60815304/profile_435f1af21353b76a79c5b70de92da6ce.jpg?fit=bounds&format=jpeg&quality=85&width=330,2026-03-26T01:19:56.156+09:00,"こんばんはー。

記事にスキ、そしてマガジンへの登録ありがとうございます。

「趣味って業が深いなぁ」
「好きだから身につける」

大共感です（笑）

好きで選んでいいるものは、ブランドとか問わずで
オックスフォードのボタンダウンのシャツ。
あと、ヘインズのビーフィーTかな。"
nc818d3c713aa9,n6d0edf9289fa,a3b393748448993682c446017554f28a,りこ@一生養生,riko_83,https://assets.st-note.com/production/uploads/images/242853208/profile_868cf0850d54d0a98ca0406d82454cfa.png?fit=bounds&format=jpeg&quality=85&width=330,2026-03-12T20:30:06.223+09:00,"「必要」より「好き」で選ぶと、毎日はちょっと楽しくなる。
名言ですね✨️φ(..)メモメモ"
nc0526e8c27999,n6d0edf9289fa,d2a137a40f986380ae27c967dc9269f5,村田 裕樹,murata_ssj,https://assets.st-note.com/production/uploads/images/166304423/profile_e1b87dd893d1eabd48db8d58723ee4b0.jpg?fit=bounds&format=jpeg&quality=85&width=330,2026-03-10T21:51:29.961+09:00,私はこだわりがないので、履きやすいTEXCY LUXEをよく買ってます。
ncc118d8c28457,n6d0edf9289fa,b39624e9464ededa053a7cbf0de179ce,あな,ana_mama_english,https://assets.st-note.com/production/uploads/images/219621833/profile_8ef662d95d545fc74251b7700219beae.png?fit=bounds&format=jpeg&quality=85&width=330,2026-03-10T17:28:13.924+09:00,"よしひろさん、こんにちは。

マガジン追加とスキをいただき、
ありがとうございます☺️
とても嬉しいです。

「必要」より「好き」で選ぶのってとてもすてきですね✨

私も、「好き」で選ぶこと、大事にしていきたいです☺️
"
nc0b2aa69163dc,n6d0edf9289fa,290f76d99eb40b676ce764b1c2a200e3,Takanashi（たかなし）,takanashi_note01,https://assets.st-note.com/production/uploads/images/235786177/profile_d3248e02f9810e16a0daf3e4a02bee0b.png?fit=bounds&format=jpeg&quality=85&width=330,2026-03-10T15:43:43.716+09:00,"この記事、私も読みました！
革靴を履いていて、足が痛いと感じることが何度もあったため、今ではレザースニーカーを愛用しています。
見た目はそれほど変わらず、防水性もある上、何より履きやすいのがポイントですね。
こだわりはあまり無いため、チヨダの靴で十分という感じです。"
ncb0a07b9b1eed,n6d0edf9289fa,32a3d5ec7b1b7751c0635f2e47ea2b11,あん｜noteと遊ぶ,aging_gracefully,https://assets.st-note.com/production/uploads/images/238258843/profile_52f43522d9e7e75a12acd9d6da59035c.png?fit=bounds&format=jpeg&quality=85&width=330,2026-03-10T15:15:59.760+09:00,"襟が汚れるから私も必ずスカーフとか巻きます。コートやジャケットを脱いだら一緒に外したりそのままだったりですけど。
お気に入りを長く着用したいですからね〜💕"
nc3be263cac9ff,n6d0edf9289fa,e6b478080c283b5be468e1b72a107e64,キユモト@'26/2/15からリスタートのnote(投稿時間は色々),kiyumoto_works,https://assets.st-note.com/production/uploads/images/264546841/profile_e382a2a4c76489edd058e43d1a63e35d.png?fit=bounds&format=jpeg&quality=85&width=330,2026-03-10T13:58:47.617+09:00,"この記事、見ました見ました！
よしひろさんは革靴スキなんですね〜。
私は記事どおり、スニーカーに移行してたりします。歩きやすくて、つい履いてしまうというところです。"
nc9f09ff38989f,ne97ea9c6de27,1d51ae91fa7dd84c116296b564e48b85,三日芽あきこ,mikka_me,https://assets.st-note.com/production/uploads/images/223795815/profile_d5fedf3b5a66dfa8682eff6f095defa0.png?fit=bounds&format=jpeg&quality=85&width=330,2026-03-23T11:05:26.989+09:00,"イヌだったら気兼ねなく手に取れる感じです。
でも、気になるなぁがずっと残る時はネコでもカメでも飼っちゃいますね。
あ、買っちゃいます😆です。"
nc00021ed6ca4a,ne97ea9c6de27,bede9bd0a510b6a3b89dcb460dd51ef5,ルルトアヤコ,lovely_coyote546,https://assets.st-note.com/production/uploads/images/264394551/profile_7d53e99488d218760c7f91157493e91b.png?fit=bounds&format=jpeg&quality=85&width=330,2026-03-15T11:59:06.671+09:00,"その時々で、心動いたら、で判断するので、カメが早歩きしよります💝その人によるところ大、ですが…

でもお初のお相手なら、キンギョから、ですね…そこから、だんだんとイヌ、ネコ…

皆さんのコメント。興味深いですねー🤨

"
nc53257cb87dad,ne97ea9c6de27,1776d27ba36c8cd0b5576d8bad2d70a3,ふじた　めぐる,megurudayo,https://assets.st-note.com/production/uploads/images/247027815/profile_2980a81391d490986cda4202b23a9a8e.png?fit=bounds&format=jpeg&quality=85&width=330,2026-03-14T10:08:31.543+09:00,"き、きんぎよ…です。
どうしてもというときはネコさん。"
nc9728c04b7b8f,ne97ea9c6de27,1f4ec93f1fba4624d1b3ef49a91e72d7,あまっ子純情,safe_lupine8306,https://assets.st-note.com/production/uploads/images/194809644/profile_12a2c8b6ea9365d51363cbf0c53b7723.png?fit=bounds&format=jpeg&quality=85&width=330,2026-03-10T22:19:27.391+09:00,"興味あるネタならネコちゃん。
推しの人ならとりで翼を授ける〜‼️ってしたくなります"
ncac0e0e05e9ef,ne97ea9c6de27,a3b393748448993682c446017554f28a,りこ@一生養生,riko_83,https://assets.st-note.com/production/uploads/images/242853208/profile_868cf0850d54d0a98ca0406d82454cfa.png?fit=bounds&format=jpeg&quality=85&width=330,2026-03-10T16:05:51.013+09:00,"こんにちは☀
イヌ、時々ネコってところでしょうか？
気になる記事が多ければ多いほど、誘惑に負けて暴走していきます✨
"
nc1053088d770a,ne97ea9c6de27,907edc26ecc556b380bd733caf94e5cc,JAU |  臨床検査技師×医療副業,jau_jau1001,https://assets.st-note.com/production/uploads/images/238898866/profile_b47389bc5953cb4d37cf45a1d4d208c2.png?fit=bounds&format=jpeg&quality=85&width=330,2026-03-10T11:42:12.842+09:00,"ものによりますが、

カメ！

ですね〜🤭✨
どんなもんか知りたい時があるので😏w

楽しい企画ありがとうございます👏✨
"
nc0af2a6132d09,ne97ea9c6de27,32a3d5ec7b1b7751c0635f2e47ea2b11,あん｜noteと遊ぶ,aging_gracefully,https://assets.st-note.com/production/uploads/images/238258843/profile_52f43522d9e7e75a12acd9d6da59035c.png?fit=bounds&format=jpeg&quality=85&width=330,2026-03-09T21:39:50.464+09:00,"んーー難しいです
なかなかの高額にも手出しますよね、やっぱり。
ここにないくらいの、、

イヌ！

Amazonペイ使ってみました！
ひとつ前ので書いてあったので、やってみたくて😆
つい流れでポチりました

"
nc0e0572b43885,ne97ea9c6de27,321af803336265192cfe9d4b1e5769ec,しょーちゃん！,rich_shrew1085,https://assets.st-note.com/production/uploads/images/140520753/profile_a73d1c21bf45ea15473d8d5dcafc457e.jpg?fit=bounds&format=jpeg&quality=85&width=330,2026-03-09T21:08:08.247+09:00,トリ！（ただし５００円以上は、よほどその時の自分に有益だと判断した記事に限ると思います）
nc98844cdf36be,n812bf7aba601,bede9bd0a510b6a3b89dcb460dd51ef5,ルルトアヤコ,lovely_coyote546,https://assets.st-note.com/production/uploads/images/264394551/profile_7d53e99488d218760c7f91157493e91b.png?fit=bounds&format=jpeg&quality=85&width=330,2026-03-08T13:32:17.878+09:00,"28歳も下…ということは、息子レベルなのねー🫣💞💞✨✨🤣🤣🤣

いつもステキなマガジンに追加して下さりありがとうございます💖💖💝🙏"
ncc537d0e20694,n812bf7aba601,907edc26ecc556b380bd733caf94e5cc,JAU |  臨床検査技師×医療副業,jau_jau1001,https://assets.st-note.com/production/uploads/images/238898866/profile_b47389bc5953cb4d37cf45a1d4d208c2.png?fit=bounds&format=jpeg&quality=85&width=330,2026-03-08T09:40:39.045+09:00,"なんか巻き込まれてる😳✨w

よしひろさん、おはようございます♪
やはり、私の１つ上の先輩でしたか👏✨

ユリーカ、良いですね〜！
私も欲しい😆✨w
ウイスキー講習会で久しぶりにインドのウイスキー「ポール・ジョン」を飲ませていただいて、やっぱり飲みやすくておすすめだなと思いました🤩

ソフトドリンクは…水です！w"
ncc1e32340c045,n812bf7aba601,66d16b607897ff3080d5fb73499091f3,まや｜女が暴露する美女攻略法,bijyo_insight,https://assets.st-note.com/production/uploads/images/260729720/profile_107581a43aa5f4b77d0ce4996da43e92.jpeg?fit=bounds&format=jpeg&quality=85&width=330,2026-03-08T08:20:18.103+09:00,"よしひろさん、こんにちは🌸
マガジンでの記事のご紹介ありがとうございます！
同じ蒸留所の飲み比べ良いですよね〜
アードベッグは飲んだことありますが、
かなりピートが強くてハイボール以外だと飲めず、、
ウイスキーだと知多とかアランがお気に入りです🥃
ノンアルだと最近は豆乳やアーモンドミルクにハマってます✨"
nce51b4eb22eb3,n3fdf34a3d4a0,fe692fbca0ebfe890c64c75f5f5f52e8,ヒチャコ～｜70年の人生で拾ったもの,rira_lilac87,https://assets.st-note.com/production/uploads/images/266588060/profile_e7a17ac1371de3178696182858a115a7.png?fit=bounds&format=jpeg&quality=85&width=330,2026-03-13T11:42:10.381+09:00,"ただ生きるためだけに働いてきました。それでも仕事で喜んでいただけるようスキルアップし、信頼と実績を積んできましたが、ただそれだけ・・・
生きる意味を探し求めた長い旅路でした。健康でなかったので、もっと開かれたチャンスがたくさんありましたが、受けられなかったのが今でも寂しい。
それでも働いてこれたことは懐かしい思い出です。私にとっていい働き方とは、自分に恥じない誠実な仕事です。・・・本当はこれしかできないのかも？"
nc237c0dadd605,n7d2823ed5523,bede9bd0a510b6a3b89dcb460dd51ef5,ルルトアヤコ,lovely_coyote546,https://assets.st-note.com/production/uploads/images/264394551/profile_7d53e99488d218760c7f91157493e91b.png?fit=bounds&format=jpeg&quality=85&width=330,2026-03-07T17:32:15.432+09:00,"よしひろさん！！！！！！

凄いやないですか〜😳"
ncfc2d4b876738,n7d2823ed5523,d58df56d72e51835fa8597640954d50b,道草ノート🌿ゆう,koya1970,https://assets.st-note.com/production/uploads/images/239663389/profile_49bb32f5cdb12b8a92a46112d883daf1.png?fit=bounds&format=jpeg&quality=85&width=330,2026-03-05T18:38:06.176+09:00,"えっ！
めっちゃ遊び心ありますねっ！(人*´∀`)
家の間取りとか見るの大好き〜🩵"
ncf8c5630e54ee,n7d2823ed5523,32a3d5ec7b1b7751c0635f2e47ea2b11,あん｜noteと遊ぶ,aging_gracefully,https://assets.st-note.com/production/uploads/images/238258843/profile_52f43522d9e7e75a12acd9d6da59035c.png?fit=bounds&format=jpeg&quality=85&width=330,2026-03-04T23:51:15.105+09:00,"こんばんは
不屈の屈葬さんのところで読んできました🤣
そしてこの隠し部屋
かなり面白いですね！！

一軒家という考えが全くないので新鮮でした💫"
nc377521883edf,n7d2823ed5523,15b07889aa53dbf10c9cb1b67625f4b4,rika🌷,meina_rikamizuki,https://assets.st-note.com/production/uploads/images/238910767/profile_373a9816961e0c2decd5f9e33be51347.png?fit=bounds&format=jpeg&quality=85&width=330,2026-03-04T22:46:17.303+09:00,"隠し部屋すごい✨️
いいなぁ〜😆

鏡を開けると
素敵なお部屋への入り口😌"
nc1ad7852e85e9,n7d2823ed5523,f70038deb9c5f3f87c2ee7969a2cf523,不屈の屈葬,fukutsunokussou,https://assets.st-note.com/production/uploads/images/228082209/profile_bc2555e2c34c9857d7b2291bb9e9cc80.png?fit=bounds&format=jpeg&quality=85&width=330,2026-03-04T22:41:55.973+09:00,"うおおおおお！！！！
これがよしひろさんの隠し部屋ーー！！！
･･･いい！！最高じゃないっすか！？
さっそく記事化したんですね！写真付でイメージふくらみます！
楽しそ～！！

鏡の後ろに部屋！！いいですね～ファンタジーな世界観！
テンション上がるやつですね！
色々「くっそう！」な部分はあるかもですが(笑)

私の記事の紹介もありがとうございます！
きっかけになれたなら幸いです！"
ncee45075151bb,n8cab03e50b52,d0c5765a47753e17543a7b9179cf317e,m o k a   ,crisp_rabbit1664,https://assets.st-note.com/production/uploads/images/244970963/profile_70498c82f9b680f43cff864d5947e3da.jpeg?fit=bounds&format=jpeg&quality=85&width=330,2026-03-09T09:14:43.796+09:00,"よしひろさん

マガジン追加
ありがとうございます(*ᴗˬᴗ)⁾⁾
お礼が遅くなりました

どうしたいか　大切ですね
また気づきを得られました

ありがとうございます♪"
ncab3d0e2800b8,n8cab03e50b52,bede9bd0a510b6a3b89dcb460dd51ef5,ルルトアヤコ,lovely_coyote546,https://assets.st-note.com/production/uploads/images/264394551/profile_7d53e99488d218760c7f91157493e91b.png?fit=bounds&format=jpeg&quality=85&width=330,2026-03-05T04:13:19.937+09:00,なんや、わからんけど、勇気を貰えた…ありがとうございます💖💖💝🙏
ncccc768e2fc76,n2ba5304a1ef0,a790aa624dded68d048acf235b85cc3c,柴わんこ,shibawaka555,https://assets.st-note.com/production/uploads/images/238902723/profile_e9480392b9cdfa2e109591cf8bd585ee.png?fit=bounds&format=jpeg&quality=85&width=330,2026-03-04T15:43:15.626+09:00,"よしひろさん、400部の購入通知、おめでとうございます✨
コングラも😊"
nc3f20bdfbee4d,n2ba5304a1ef0,907edc26ecc556b380bd733caf94e5cc,JAU |  臨床検査技師×医療副業,jau_jau1001,https://assets.st-note.com/production/uploads/images/238898866/profile_b47389bc5953cb4d37cf45a1d4d208c2.png?fit=bounds&format=jpeg&quality=85&width=330,2026-03-03T14:23:51.510+09:00,"よしひろさん、こんにちは！
コングラ12個はヤバいですね👏✨

しかも有料記事もチップも素晴らしい数🤩
本当に羨ましいです🥹✨
これからもよしひろさんのご活躍を期待しています🎉"
ncea887702f148,n2ba5304a1ef0,24ae8442856f6e3b72ae8eee40690c51,Mie,genial_cat129,https://assets.st-note.com/production/uploads/images/259954001/profile_5d311f6904fdf72781a68dbd8a987133.png?fit=bounds&format=jpeg&quality=85&width=330,2026-03-02T20:47:19.363+09:00,"よしひろさん
コングラボード１２個✨
おめでとうございます🎉
偶数っていいですね！
奇数もいいけどね。（どっちやねん）
プレミアムだと予約投稿できるんですね。どちらにしても私は
行き当たりばったりなので
使いこなせないかもですが
レポート楽しみにしております🍀
ありがとうございます😊"
ncecbb6fee2555,n932f674eaa2c,aefdbe2c616c4952074a5fb37ae88b60,かなハム,himawarino86,https://assets.st-note.com/production/uploads/images/170523869/profile_2e298a41cb0d68341ce03fb1a8ad5bb7.jpg?fit=bounds&format=jpeg&quality=85&width=330,2026-03-01T22:51:11.346+09:00,"明宝ハムのスコーン、どんなお味なのでしょうか…気になります(^-^;
お惣菜風味のスコーンは珍しいですね😲"
ncc81ccb53aea6,nfe318589c010,24d060d3818b37a5dde84ee51a735c45,金田まり|スタートアップ&起業支援してるワーママ,alive_sheep6563,https://assets.st-note.com/production/uploads/images/267547136/profile_058271d3689074a31099e0ff4810c782.png?fit=bounds&format=jpeg&quality=85&width=330,2026-03-01T17:28:28.613+09:00,"名鉄がこんなに混んでるの初めて見たかもです👀

母が１週間ほど前に名鉄の閉店セールに行った時も激混みだったそうです⚡️
よく行ってたから閉店寂しいなあ〜"
nc3c384ad13999,nfe318589c010,62682d94f2f4d5e27cfc09d513e2be31,五十嵐雉虎（イガラシ・キジトラ）｜準文筆家｜掌編小説・ショートショート作家,kijitora50storm,https://assets.st-note.com/production/uploads/images/177475360/profile_590d0419ed4a65e554de7e8288c064e4.png?fit=bounds&format=jpeg&quality=85&width=330,2026-02-28T22:35:52.724+09:00,"一時期、名古屋にいたことがあるので、ナナちゃん懐かしいです。

名鉄百貨店閉店でナナちゃんの去就が話題になっていましたが、百貨店から名古屋鉄道に移籍して、当面は現在の位置で現役続行となったとか。"
nc64263f5d999c,nfe318589c010,15b07889aa53dbf10c9cb1b67625f4b4,rika🌷,meina_rikamizuki,https://assets.st-note.com/production/uploads/images/238910767/profile_373a9816961e0c2decd5f9e33be51347.png?fit=bounds&format=jpeg&quality=85&width=330,2026-02-28T22:06:46.753+09:00,"名鉄百貨店なくなっちゃったんですね💦
知らなかったです😅
何かずっとあったものがなくなるの寂しいなぁ……。"
ncfcbe491b5692,n3ad22c5385a3,015037404761902ab6353eab77a5ddfe,ゆかいな山,yukaiyama,https://assets.st-note.com/production/uploads/images/187377393/profile_9f501afa0524739a6c4fab2d21d3de93.png?fit=bounds&format=jpeg&quality=85&width=330,2026-04-19T20:07:37.619+09:00,"よしひろさんのこのnoteを読んで、私も自分の経験のnoteを仕上げたいと思えました。
この投稿を引用しても良いですか？"
ncbbe6728ceffa,n3ad22c5385a3,318d0f2260033fed8c47ced01cacaec5,心の軌跡を届けるAyuna☆　誰かの勇気になるために,sasn,https://assets.st-note.com/production/uploads/images/241119400/profile_5d6f0f7bd87b0faeaf16702f2a48a204.png?fit=bounds&format=jpeg&quality=85&width=330,2026-02-28T20:45:25.956+09:00,"私も同感です。
いろんなことがあって、人間は味が出ると思うので、良いときも悪いときもあるし、未然に防ぐことばかりしなくてもいいのかなと。
とんでもなく心配になりますけどね(笑)"
