comment_id,note_key,user_key,user_name,user_urlname,user_icon,commented_at,body
ncbccb99a0d3a2,n08c59d5fe01f,d58df56d72e51835fa8597640954d50b,道草ノート🌿ゆう,koya1970,https://assets.st-note.com/production/uploads/images/239663389/profile_49bb32f5cdb12b8a92a46112d883daf1.png?fit=bounds&format=jpeg&quality=85&width=330,2026-02-12T22:42:45.342+09:00,"『今日はいつもより
数分でも早く布団に入って。』いつもいつも早寝しなきゃと思っていてもできなかったけれど、よしひろさんのこの一文読んで、あ、もう横になろうって思って布団入りました🤭"
nca6ffb4c40a34,n08c59d5fe01f,9735e1bac7ba0bc5d0af33cf56157b08,enyo*えんよう🗝️,keyoflife_enyo,https://assets.st-note.com/production/uploads/images/240644209/profile_1ac1d8614044bc9c45db88b11d02d8f6.png?fit=bounds&format=jpeg&quality=85&width=330,2026-02-12T22:00:43.606+09:00,"よしひろさん、こんばんは🌙

スモールステップの私には、しっとり染み入る化粧水のような記事でした🧴✨
インフルも気をつけてたいですね😷

マガジンへの追加もありがとうございます🌈"
nc6861700f2751,n08c59d5fe01f,f7a0de6679f4a0f44b2bcdf07a5e923d,等身大のT-Pen,29toshi,https://assets.st-note.com/production/uploads/images/177030490/profile_6d3eed5ab769864ce923885f12ab2f34.png?fit=bounds&format=jpeg&quality=85&width=330,2026-02-12T20:50:56.582+09:00,"「そんなに遠くじゃなくてもよい」
共感しかないです😁

僕の場合、気合い入れて遠くのゴール設定し、設定した時点で息切れ。
または、途中でそのゴールに興味が無くなる。

近いゴール設定の方が小回りが効いて合っていたようなので、心がけていたところにこちらの記事を拝見して思わずコメントさせていただきました✨

素敵な記事をありがとうございますー"
ncadf59047940b,n08c59d5fe01f,15b07889aa53dbf10c9cb1b67625f4b4,rika🌷,meina_rikamizuki,https://assets.st-note.com/production/uploads/images/238910767/profile_373a9816961e0c2decd5f9e33be51347.png?fit=bounds&format=jpeg&quality=85&width=330,2026-02-12T20:41:18.579+09:00,"インフル流行ってるらしいですね💦
前の学童のあった小学校も今、学年閉鎖ばっかりらしいです……。
最近録画してるドラマとか見るのに忙しくて全くニュース見てなかったから、そんなに流行ってるの知らなかった🤣"
nc517b5de30455,nfc0b833a4999,c068f7865d8e0da6555ec8d5b896bf89,くすり。。,crystal_shine,https://assets.st-note.com/production/uploads/images/236251541/profile_ab33998a42f921a3d102004f1dc24467.png?fit=bounds&format=jpeg&quality=85&width=330,2026-02-21T11:07:20.739+09:00,"よしひろさん

こんにちは☀️
猫ちゃん、癒されました🐈💓

ありがとうございます✨


私は犬カフェでも、始めようかな？なんてね🐶"
ncbb9d9a115a26,nfc0b833a4999,981fabd5de074708dbb6aaf65ff99f04,musicat/おとねこ,real_phlox8176,https://assets.st-note.com/production/uploads/images/237713470/profile_2774fda1b9199e603d2c82ed8a8bc97d.png?fit=bounds&format=jpeg&quality=85&width=330,2026-02-14T00:50:44.068+09:00,"猫呼びました？
お菓子もいります？🐈️

今回もありがとうございます🌿
"
nc8b882648116a,nfc0b833a4999,bede9bd0a510b6a3b89dcb460dd51ef5,ルルトアヤコ,lovely_coyote546,https://assets.st-note.com/production/uploads/images/264394551/profile_7d53e99488d218760c7f91157493e91b.png?fit=bounds&format=jpeg&quality=85&width=330,2026-02-13T20:10:34.214+09:00,ネコ、🐈🐈‍⬛😻😹😿猫カフェ〜癒される〜〜😍💗ありがとう😊
nc9fbbcd4b420f,nfc0b833a4999,b35ca69ef58773c811ef27134634831b,ちびた,happy_emu3092,https://assets.st-note.com/production/uploads/images/192836207/profile_aa7eda04d33ab86b70e56f74b282b523.png?fit=bounds&format=jpeg&quality=85&width=330,2026-02-12T13:37:10.006+09:00,"猫カフェキターーーーーー！！
と思って入店しちゃいました(*^▽^*)

モフモフ天国、癒しの空間！！
最高です！！

最近SNSで「サモエドカフェ」なるものの画像が流れてきて
気になってます。

いや、でもやれってことじゃないですからね？！
あの、いや本当、違うんですよ！

「違うんですよ」って言うたび、
熱湯を前に「押すなよ？！」
って言ってるあの映像が脳内を流れてくるのはなぜだｗ

違うんですよ！！ｗ"
nce8edb3173a71,nfc0b833a4999,15b07889aa53dbf10c9cb1b67625f4b4,rika🌷,meina_rikamizuki,https://assets.st-note.com/production/uploads/images/238910767/profile_373a9816961e0c2decd5f9e33be51347.png?fit=bounds&format=jpeg&quality=85&width=330,2026-02-12T08:58:54.401+09:00,"今回も一緒にお茶できて楽しかったよ〜😊✨️
猫に癒された〜(=^・・^=)♥️

喫茶店記事気づけてよかったです🥹
たまに仲良しさんの有料note出てるの気づかないときがあって、最近出してないのかなー？ってその人のページに飛ぶと、あれ？出してる！！！ってなるのです……。Ω＼ζ°)ﾁｰﾝ"
ncc0125bbc91f3,nb7d26a011fc0,b35ca69ef58773c811ef27134634831b,ちびた,happy_emu3092,https://assets.st-note.com/production/uploads/images/192836207/profile_aa7eda04d33ab86b70e56f74b282b523.png?fit=bounds&format=jpeg&quality=85&width=330,2026-02-13T15:38:48.637+09:00,"おめでとうございます！

さすが、めっっちゃスピーディーに審査に合格されてて、本当すごいです！！＼(^o^)／

パーティーしなきゃですね！！✨"
ncfa8e766b9a63,nb7d26a011fc0,3e75f4bb22e3e8ef5f47c76fce84ed47,鈴森よいほ｜AIコンテンツ/思想型クリエイター,yoiho25june,https://assets.st-note.com/production/uploads/images/242279897/profile_2db3d5cbd59beffac37a4fbff5a53902.png?fit=bounds&format=jpeg&quality=85&width=330,2026-02-13T15:19:29.924+09:00,"よしひろさん、こんにちは☀️
アマゾンアソシエイト合格されたんですね🎉

わぁ🙌💕
良かった〜🥰
気になってたんです👀

安心しました🍀
これでじゃんじゃんAmazonでも稼いでくださいませ🤭

お礼に伺うのが遅くなりました。
いつもマガジン追加ありがとうございます🙇‍♀️
"
nc7ef2dff3ff49,nb7d26a011fc0,15b07889aa53dbf10c9cb1b67625f4b4,rika🌷,meina_rikamizuki,https://assets.st-note.com/production/uploads/images/238910767/profile_373a9816961e0c2decd5f9e33be51347.png?fit=bounds&format=jpeg&quality=85&width=330,2026-02-11T08:25:04.770+09:00,"わぁ〜！！
おめでとうございます🎉✨️

凄いです☺️
よしひろさんならいける！って変な期待が私のなかにあったので、本当に良かった〜！！✨️"
ncbdfe3c9ed4a2,nb7d26a011fc0,981fabd5de074708dbb6aaf65ff99f04,musicat/おとねこ,real_phlox8176,https://assets.st-note.com/production/uploads/images/237713470/profile_2774fda1b9199e603d2c82ed8a8bc97d.png?fit=bounds&format=jpeg&quality=85&width=330,2026-02-10T23:32:27.902+09:00,"よしひろさん、こんばんは🌙😃

えぇっ！審査合格するの早っ！
おめでとうございます( ^-^)ノ∠※。.:*:・'°☆
紹介の仕方がお上手なんです♪見習おう。うん。
私、一ヶ月半くらいかかったような…(笑)"
ncc9058aeebf77,nb7d26a011fc0,907edc26ecc556b380bd733caf94e5cc,JAU |  臨床検査技師×医療副業,jau_jau1001,https://assets.st-note.com/production/uploads/images/238898866/profile_b47389bc5953cb4d37cf45a1d4d208c2.png?fit=bounds&format=jpeg&quality=85&width=330,2026-02-10T21:27:59.069+09:00,"よしひろさん！こんばんは！
Amazonアソシエイト合格おめでとうございます🎉

なんか一瞬で合格しているような✨
凄すぎです👏✨

しかも、オレンジピールなんて最高のオツマミですね❣️私、大好きです🥳

そして、フォローもしてくださり本当に感謝しております🥹
これからも、よしひろさんの記事を拝見し、学ばせていただきます☺️
こちらもフォロバさせていただきます🙇‍♂️✨"
nc4d818a084d95,n8d0a2a1ed3f9,bede9bd0a510b6a3b89dcb460dd51ef5,ルルトアヤコ,lovely_coyote546,https://assets.st-note.com/production/uploads/images/264394551/profile_7d53e99488d218760c7f91157493e91b.png?fit=bounds&format=jpeg&quality=85&width=330,2026-02-13T06:33:32.923+09:00,"よしひろさん、いつもマガジンへの追加、ほんまにありがとうございます💖💖💝🙏


私もメール📩から、通知受け取って見てます❣️

懇切丁寧な説明記事、さすがです👍"
ncd069af4785d4,n8d0a2a1ed3f9,7fefc63f6dcaf5c2f9038cdaeb5b4a54,ルー＝シャーナ（ルーシャーナ）｜感覚をことばにする往復便,jolly_lupine2962,https://assets.st-note.com/production/uploads/images/239592709/profile_250d34144fa08d815200c316945962d1.png?fit=bounds&format=jpeg&quality=85&width=330,2026-02-09T20:47:44.292+09:00,"よしひろさん✨
はじめまして🌿
マガジン追加していただいて感謝です！

悲しいとき〜！記事購入のお礼メッセージが読めない時～😭
最近私も2回ほど同じことがあって、「えっ、なんで…」となっていたので、他にも同じ方がいらっしゃると知って少し安心しました。

とはいえ、見られないのはやっぱり悲しいですよね…！
私も通知まわりを整理して設定見直してみたほうがいいなと思いました。
良い記事をありがとうございます🌿"
ncec62b108f636,n8d0a2a1ed3f9,15b07889aa53dbf10c9cb1b67625f4b4,rika🌷,meina_rikamizuki,https://assets.st-note.com/production/uploads/images/238910767/profile_373a9816961e0c2decd5f9e33be51347.png?fit=bounds&format=jpeg&quality=85&width=330,2026-02-09T17:28:51.984+09:00,"よしひろさん！
メール設定面倒くさいな〜って思って触ってたら、アプリのマイページ隣の設定ボタン押して、購入履歴見たら
全部アプリで見れた！

なんか嬉しくて報告しました☺️🩷
午前中はよしひろさんからのお礼が読めないどうしよう〜って大騒ぎして、メッセージで送ってもらったのにごめんなさい|дﾟ)ﾁﾗｯ"
ncd46d098e1bc9,n8d0a2a1ed3f9,32a3d5ec7b1b7751c0635f2e47ea2b11,あん｜noteと遊ぶ,aging_gracefully,https://assets.st-note.com/production/uploads/images/238258843/profile_52f43522d9e7e75a12acd9d6da59035c.png?fit=bounds&format=jpeg&quality=85&width=330,2026-02-09T17:22:27.278+09:00,"よっしーさん
こんにちは♪

おかげさまで、メール設定したら便利です。
Gmailに変更もしたのですが、
今までより断然便利になりました！
最初からGmailにしていたら問題なかったのかもしれません😊
いつもありがとうございます。"
ncc2cd7e3cc83b,n84126d079255,4f0edd9c0bfaca74d478c80494b46b11,EARTH🌎,fast_thyme336,https://assets.st-note.com/production/uploads/images/235743359/profile_2740ccf3a53b6a5d717da6689f13e86e.png?fit=bounds&format=jpeg&quality=85&width=330,2026-02-09T20:03:48.691+09:00,良いですね💝
nc1eaa2f0a1a11,n84126d079255,83e5f78b9b7b83fe911db049b95a1d27,えびしま| AI×noteで生活に余白をつくる,emi_dh,https://assets.st-note.com/production/uploads/images/243764210/profile_e472159630049af76169c820dc45c9cb.png?fit=bounds&format=jpeg&quality=85&width=330,2026-02-09T06:41:02.059+09:00,"よしひろさん

１㌔練乳は独身だったら間違いなく購入していました。
欲しい・・

いちご狩り🍓いいですね✨
楽しそうです😊"
nc6a4aa6460db5,n84126d079255,32a3d5ec7b1b7751c0635f2e47ea2b11,あん｜noteと遊ぶ,aging_gracefully,https://assets.st-note.com/production/uploads/images/238258843/profile_52f43522d9e7e75a12acd9d6da59035c.png?fit=bounds&format=jpeg&quality=85&width=330,2026-02-08T22:57:03.958+09:00,"記事が更新されてる
途中経過を投稿する新スタイルなのですね。
色々されていて面白い🍓
"
ncb031e77a5d13,n84126d079255,15b07889aa53dbf10c9cb1b67625f4b4,rika🌷,meina_rikamizuki,https://assets.st-note.com/production/uploads/images/238910767/profile_373a9816961e0c2decd5f9e33be51347.png?fit=bounds&format=jpeg&quality=85&width=330,2026-02-08T11:20:09.320+09:00,"わかります💦
こっちもチラチラ降ってますよ〜☃️
同じ三重県だから、親近感湧きます！笑
でも、空が少しずつ明るくなってきました☺️

いちご🍓甘かったかな？
いちご狩りめっちゃ楽しそうですね😆"
nc3403542e9d01,n84126d079255,db9db39705617c94103dd751b1640a67,サポ　,bright_snipe9802,https://assets.st-note.com/production/uploads/images/222169516/profile_2a7b6d3c2b33da10eae02ca9624f294b.jpeg?fit=bounds&format=jpeg&quality=85&width=330,2026-02-08T10:56:31.968+09:00,"大きいですねー🍓🍓🍓

ハウスの中は暖かいのかしら？✨ごゆっくりー✨"
nc59a65f7517bf,n84126d079255,dcaf51c5cb5c2c9724b67fec1c728544,みずか｜ほころんでは、ほどく。子どもとの日々から,mizuka__,https://assets.st-note.com/production/uploads/images/252096893/profile_487b0797252acba719f63d29347aa42a.jpeg?fit=bounds&format=jpeg&quality=85&width=330,2026-02-08T10:51:26.606+09:00,"美味しそー🍓
雪がチラつくなかでのいちご狩りって新鮮ですね🎵"
ncdc3dc13b23cf,n84126d079255,c207127fa45a515b76f9ae050bd52112,ののさん🌸ゆっくりのんびり私らしいnote,ai1512take,https://assets.st-note.com/production/uploads/images/211922575/profile_2cfc1175f5e82a47ed7053885507759e.png?fit=bounds&format=jpeg&quality=85&width=330,2026-02-08T10:47:21.441+09:00,"美味しそうなイチゴがたくさんですね🍓
たくさん食べてきてください🤭💓"
nc2b4c10d0365b,n84126d079255,bede9bd0a510b6a3b89dcb460dd51ef5,ルルトアヤコ,lovely_coyote546,https://assets.st-note.com/production/uploads/images/264394551/profile_7d53e99488d218760c7f91157493e91b.png?fit=bounds&format=jpeg&quality=85&width=330,2026-02-08T10:39:42.417+09:00,"まさに、速報って、わかる記事👀

大阪も今、雪降ってきた~❄️🌨️

美味しそうなイチゴ🍓たち…お子さまも喜ばれたでしょうね〜

あと、暖かくして、お帰りください♪♪(*^^)o∀*∀o(^^*)♪"
ncf5a921a143c8,n84126d079255,685d473fa4f471b5b9f52de0d570a2f0,さとりのさとり,kopailog,https://assets.st-note.com/production/uploads/images/226182676/profile_094199e7fa1bff58de5da5e07a1a43de.png?fit=bounds&format=jpeg&quality=85&width=330,2026-02-08T10:34:07.610+09:00,"美味しそうな🤤
さとさんの定番コメントでした🍓

千葉は雪すごいっすよー⛄"
ncfcb25b172c5f,na32900da757d,f19d138b5f57bc35ca0f56f51ab37ac5,りーまむ,ri_mam,https://assets.st-note.com/production/uploads/images/186523962/profile_939af6d936ad6ca5456ee55e7d9d6404.jpeg?fit=bounds&format=jpeg&quality=85&width=330,2026-02-10T15:32:05.047+09:00,"あいかわらずのおしゃれさん🩷

そして、さらっとAmazonアソシエイトの審査をクリア✨

かっこよ〜〜〜"
nc1171de29ae7f,na32900da757d,b0c63385960edb1d4955bd1295f6826d,にわにん,nai114,https://assets.st-note.com/production/uploads/images/256119074/profile_f32b1767095f55d75a67f5d4c4378e7e.jpg?fit=bounds&format=jpeg&quality=85&width=330,2026-02-10T09:14:12.353+09:00,"おしゃれリーダー
もしくは番長。

その名がふさわしく感じられる
今日この頃です。

私にとっての
おしゃれの情報は
よしひろさんのノートからしか入ってきません。
また教えてください！
読んでるだけでレベルアップできるかもしれない。
ありがとうございます😆
"
nc48cb978bf5de,na32900da757d,bede9bd0a510b6a3b89dcb460dd51ef5,ルルトアヤコ,lovely_coyote546,https://assets.st-note.com/production/uploads/images/264394551/profile_7d53e99488d218760c7f91157493e91b.png?fit=bounds&format=jpeg&quality=85&width=330,2026-02-10T04:32:51.009+09:00,"おっしゃるように、服は試着するの、良いですね〜

カタログ通販とかで、モデルさんが着用されているのを見て購入して、自分が着用すると全くイメージと違う…そんなことありがちやもんねー

スタイルの良いモデルさんと、ちょっと、ん？な私とでは、雰囲気全くかわります😅

いつも、感じの良い文章書かれていて、勉強させてもらってます。

オシャレやわ〜よしひろさん😄"
nce5d57d2b63d8,nf9c58d62490d,bede9bd0a510b6a3b89dcb460dd51ef5,ルルトアヤコ,lovely_coyote546,https://assets.st-note.com/production/uploads/images/264394551/profile_7d53e99488d218760c7f91157493e91b.png?fit=bounds&format=jpeg&quality=85&width=330,2026-02-07T23:24:05.655+09:00,"よしひろさん💖

いつもありがとうございます💖💖💝

10万ビューおめでとうございます㊗️🎉🍾

こうして、きちんと自己開示しで、振り返りされてる所、見習います💖💖💝

ステキなとこやと、尊敬します💖💖💝"
nc518f5f9c2fbc,nf9c58d62490d,907edc26ecc556b380bd733caf94e5cc,JAU |  臨床検査技師×医療副業,jau_jau1001,https://assets.st-note.com/production/uploads/images/238898866/profile_b47389bc5953cb4d37cf45a1d4d208c2.png?fit=bounds&format=jpeg&quality=85&width=330,2026-02-07T19:15:44.816+09:00,"よしひろさん、こんばんは！
10万ビューおめでとうございます🎉

私もnote始めて1年くらいになりそうですが、この差🤣✨w
本当によしひろさんの言葉には楽しさがあり、説得力があり、とても尊敬しています🙇‍♂️✨

これからもよしひろさんを応援しています👍
いつも私の記事にスキを押していただき感謝しています♪"
ncce57080c33f8,nf9c58d62490d,4538b1bf2bc68bad9b44ee65b925e8d7,月花の雫 | 明日ってさ、月が欠けたら来ないよね～　人生の夜を照らすお供に,shiso_to_basil,https://assets.st-note.com/production/uploads/images/245061439/profile_d9fc767d436db3f445735f3499e44dea.jpg?fit=bounds&format=jpeg&quality=85&width=330,2026-02-07T16:13:42.329+09:00,"10万ビューおめでとうございます🎊
凄いですね✨
200記事も、その忙しさから思うと
中々奇跡的な数字に思えます

私は、始めたばかりの頃は
毎日何度もボード見てました
最近は数日に１回？

数字は嘘をつかない、って言いますもんね！

振り回され過ぎず指標として持っておくの

とても良い距離感😊

これからも楽しく続けて下さい🤗



"
ncaaf7ffbf08ee,nf9c58d62490d,1855ab43007be46a347e898053d57368,Viola,viola9836,https://assets.st-note.com/production/uploads/images/152908817/profile_5559a313443730e2c26f44c056f1ba4c.jpeg?fit=bounds&format=jpeg&quality=85&width=330,2026-02-07T13:31:39.389+09:00,"おめでとうございます㊗️
10万ビュー🎊　ここからまた次のステージへ、という一区切りですね。

今後も素敵な記事を発信なさってください🎶"
nc2273914fdb1d,nf9c58d62490d,3a07bbf39f62dca69a000064efb4f859,ゆまま｜世帯年収400万で年間100万貯金をする主婦,noble_hare4289,https://assets.st-note.com/production/uploads/images/268073236/profile_2851b9702b1e202f0607cd443ad927e3.png?fit=bounds&format=jpeg&quality=85&width=330,2026-02-07T13:02:50.684+09:00,"よしひろさん
ゆままです。
この度は、本当に
本当におめでとうございます✨🍻🍶
たくさんの方を幸せにする
よしひろさんのnote
ますますたくさんの方にみて頂けますように…
はじめて10万ビュー
みました。
改めておめでとう御座います✨🍾
"
nc861b7a77435c,nf9c58d62490d,3e75f4bb22e3e8ef5f47c76fce84ed47,鈴森よいほ｜AIコンテンツ/思想型クリエイター,yoiho25june,https://assets.st-note.com/production/uploads/images/242279897/profile_2db3d5cbd59beffac37a4fbff5a53902.png?fit=bounds&format=jpeg&quality=85&width=330,2026-02-07T05:55:00.951+09:00,"よしひろさん、おはようございます☀

10万ビューおめでとうございます🎊
200記事投稿も凄いですね✨

きっとますますよしひろさんのnote成長されるのでしょうね🌸

これからのご活躍と記事、楽しみに時々遊びに来ますね☺️"
nc1199381952c9,nf9c58d62490d,35032a872ef338f6bbc0a85288de5944,あまね〘ฅ՞•ﻌ•՞ฅฅ^•ﻌ•^ฅ〙,almabrillante,https://assets.st-note.com/production/uploads/images/238959793/profile_08b2cb438cc06577581118d317494042.png?fit=bounds&format=jpeg&quality=85&width=330,2026-02-06T23:13:27.791+09:00,"よしひろさん、こんばんは🌛*゜

充満、10万ビュー🤭ﾌﾌｯ
オヤジギャ……

あ、違う💦

10万ビューおめでとうございます！㊗️🎊👏😆"
nc06a8412ee80a,nf9c58d62490d,f70038deb9c5f3f87c2ee7969a2cf523,不屈の屈葬,fukutsunokussou,https://assets.st-note.com/production/uploads/images/228082209/profile_bc2555e2c34c9857d7b2291bb9e9cc80.png?fit=bounds&format=jpeg&quality=85&width=330,2026-02-06T23:08:22.296+09:00,"10万ビューおめでとうございます！！
すごい…！！
200本もすごい…！思わず自分の記事数えたら62本でした(笑)"
nc40534313bfd4,nf9c58d62490d,f19d138b5f57bc35ca0f56f51ab37ac5,りーまむ,ri_mam,https://assets.st-note.com/production/uploads/images/186523962/profile_939af6d936ad6ca5456ee55e7d9d6404.jpeg?fit=bounds&format=jpeg&quality=85&width=330,2026-02-06T23:00:10.096+09:00,"10万ビューおめでとうございます🎉

スクショに写ってる記事、
「あー、なつかしいなぁ」って思ってみてました。
全部読んでると思う😊

これからも楽しく読ませていただきますね🎵"
nc981ccde5adde,nf9c58d62490d,32a3d5ec7b1b7751c0635f2e47ea2b11,あん｜noteと遊ぶ,aging_gracefully,https://assets.st-note.com/production/uploads/images/238258843/profile_52f43522d9e7e75a12acd9d6da59035c.png?fit=bounds&format=jpeg&quality=85&width=330,2026-02-06T22:24:29.143+09:00,"10万ビューおめでとうございます㊗️
200記事投稿もおめでとうございます🎊🎉

よっしーさん
いつもゆるーく、やさしーく、学びのある記事ありがとうございます😊
その口調が親しみやすいのでしょうね〜
"
nc2d65004d15f1,nf9c58d62490d,0283b96a011b3d44c7b4ae6a1ed30ae9,営業fafa | note業界No.1営業マン,kohana1112,https://assets.st-note.com/production/uploads/images/231018078/profile_b3bbbe00a8972338d5f563a39e002d1b.png?fit=bounds&format=jpeg&quality=85&width=330,2026-02-06T21:16:55.273+09:00,"10万ビュープラス200記事おめでとうございます㊗️

ハイペース過ぎて尊敬です🫡

また勉強しに記事読みにいきますね。"
nc23018c683eb4,nf9c58d62490d,d58df56d72e51835fa8597640954d50b,道草ノート🌿ゆう,koya1970,https://assets.st-note.com/production/uploads/images/239663389/profile_49bb32f5cdb12b8a92a46112d883daf1.png?fit=bounds&format=jpeg&quality=85&width=330,2026-02-06T21:14:12.977+09:00,"よしひろさん
㊗️10万ビュー‼️
すごいです〜憧れます〜
(人*´∀`)✨"
nca8bc1a3333f5,nf9c58d62490d,82dd8717325a4e053e7ff44328dc343e,こみ,eager_pothos5160,https://assets.st-note.com/production/uploads/images/252617188/profile_69ef9a002680c34accae10879d9ef09e.png?fit=bounds&format=jpeg&quality=85&width=330,2026-02-06T18:26:55.047+09:00,10万ビュー達成、本当におめでとうございます🎉 10万という数字の大きさもさることながら、冷静に見るとスキ率とコメント率が「えぐい」ことになっていませんか！？（笑） 広く読まれつつ、ここまで深く愛されている証拠ですね。 PV以上に、そのエンゲージメントの高さを目標にさせていただきます！
ncb53b653cfff9,nf9c58d62490d,a790aa624dded68d048acf235b85cc3c,柴わんこ,shibawaka555,https://assets.st-note.com/production/uploads/images/238902723/profile_e9480392b9cdfa2e109591cf8bd585ee.png?fit=bounds&format=jpeg&quality=85&width=330,2026-02-06T17:07:56.742+09:00,よしひろさん、10万ビューと、200記事達成、おめでとうございます🎉キリの良い数字同士が近いと、なんだかすごく良いことが起きそうに私は感じます😆
nc57e2efc3fdfe,n793735f4b51c,1855ab43007be46a347e898053d57368,Viola,viola9836,https://assets.st-note.com/production/uploads/images/152908817/profile_5559a313443730e2c26f44c056f1ba4c.jpeg?fit=bounds&format=jpeg&quality=85&width=330,2026-02-07T13:46:37.841+09:00,"よしひろさん
新記事をマガジンへ追加していただき、ありがとうございました。

スキンケア凄〜い! 私より遥かに上をいくケアしていらっしゃる。
お洋服もそうですが、とても綺麗にしていらっしゃるのがよくわかります。

以前職場に、太っていて、脂ギッシュな肌質タイプの男性がいたのですが、完璧に小綺麗にしていてお洒落なので、清潔感を感じ、体型も全く気になりませんでした。
生き方って大事ですよねぇ"
