comment_id,note_key,user_key,user_name,user_urlname,user_icon,commented_at,body
nc6c6081d30673,n7b2adc832d74,3e6fd263d73c4a43d84b61f816062c4f,かっぱの庵,leal_oriole8107,https://assets.st-note.com/production/uploads/images/169525688/profile_3908df5d317e1d614be9864701a72351.jpg?fit=bounds&format=jpeg&quality=85&width=330,2026-02-22T04:19:42.541+09:00,"70年代、ギリギリ生まれてました〜が、こういうカッコいい音楽を理解できる年齢ではなくて、ミーハーにピンクレディ（と、志村けん）ばかり見てたもんで、😅

今回のMVで聴いてむしろ新鮮で、「かっこいいなあ〜」って感じました。
そして、塩ビ女子の皆さん、マーコさんのノリノリの姿がとにかく可愛い、楽しい。😆
（マーコさん…あの妖艶な赤いドレスとのギャップが…！）

"
ncf715a7506b64,n7b2adc832d74,6163fc5d5f0c9f8f34c2c0fe25a53f62,顔のない問い,sasoib_ehtal,https://assets.st-note.com/production/uploads/images/238869884/profile_a2c72772e53cbe97d49b7b0837a9c0a3.png?fit=bounds&format=jpeg&quality=85&width=330,2026-02-22T00:29:02.835+09:00,"マー子が後半存在感がヤバいっすwwwww
いつもにも増してクセになる感じでした✨"
nc5d45aa6000c2,n7b2adc832d74,40234e86bc64f758e20f912254e67ef1,KITAcore｜キタコレ＠ログプレイヤー,ktcrs1107,https://assets.st-note.com/production/uploads/images/223627119/profile_d5c267fbb0a27f4c2b86cb89c6ca6a62.png?fit=bounds&format=jpeg&quality=85&width=330,2026-02-21T22:51:59.338+09:00,"やられたw
私は、これ好きっすw

ところで、ベースないっすよね？！w"
ncdae4e5fb96cd,nfd2e1bfb6dea,ceb9f20beef56f72c10ed1c4bc125c74,ゆらり🌹🫧　🫶💕,huge_coot6820,https://assets.st-note.com/production/uploads/images/239767432/profile_47e4f415224790b9faa65da8165fa21d.jpeg?fit=bounds&format=jpeg&quality=85&width=330,2026-03-25T22:32:46.825+09:00,"面白そうなの沢山あって
どこに入ろうか
迷っちゃった。
🫢ふふ。

ダンスの動きも凄いね🌸🫧


歌舞伎町文化会館
お客様３人。。

お掃除の人。。

めっちゃ面白い❣️

充実しすぎ動画。🫢ふふ
"
ncc7ddfd4be991,nfd2e1bfb6dea,38823c439afdba7959c3f0cc915d7645,ママンマフィン,mamanmafin,https://assets.st-note.com/production/uploads/images/223465348/profile_60a10c14d7fb9209cbb371bf4fbf2893.png?fit=bounds&format=jpeg&quality=85&width=330,2026-02-25T10:53:26.922+09:00,ドヤゴスローリ！うけるぅ～🤣ザ・モンキーズもやって欲しいです。
ncf5d31dbd7368,nfd2e1bfb6dea,b7db3b15d87a66784a99eb729fa5cf60,AI学習コーチAKIRA,ai_yokai_master,https://assets.st-note.com/production/uploads/images/174969087/profile_2644796b864cdfd2e35d11a6ef33999c.jpg?fit=bounds&format=jpeg&quality=85&width=330,2026-02-24T08:06:34.907+09:00,"今回も凄いのが来ましたね
ビートルズまで”攻略”した印象です
週末の作品に期待です😍"
nc11532464651a,nfd2e1bfb6dea,a252b321cec543e6af8b44dc9fa93207,夏目 龍頭｜AI Creative Lab,shio_batapopcorn,https://assets.st-note.com/production/uploads/images/263672181/profile_0050e29d6705f37e9790ef4faec1df2d.png?fit=bounds&format=jpeg&quality=85&width=330,2026-02-22T14:36:48.931+09:00,"発売4/1ですかね！？
アマゾ〇でも販売してもらえますかぁあぁ！？(*´Д｀)
予約開始はいつからですか！？╰(*°▽°*)╯✨
最高過ぎます！！🤤✨推しの集結、最高…💖"
nc8af670849d77,nfd2e1bfb6dea,9fbb14f963f531e8587499ccc49f9e7c,メイシン,mei_shin,https://assets.st-note.com/production/uploads/images/241162803/profile_0028379334c6bde12d7cac1220b4e6a0.png?fit=bounds&format=jpeg&quality=85&width=330,2026-02-21T15:54:31.413+09:00,"...Σ(ﾟДﾟ)
DoYAGOSLORI（ドヤゴスローリ）✨面白い🤣
レディがなんだかもうイキイキしていて、
それを見ているだけでとっても楽しいです！！
週末とは...今週末？
一体何が登場するのか、ドキドキしてます笑"
nc5a101dd265f3,nfd2e1bfb6dea,42ba33a53649917f0378edcecd8aa315,水鶏姫猫,joyous_quoll8288,https://assets.st-note.com/production/uploads/images/247137531/profile_9c261ff17eaaa55603e7f649eb8faef4.png?fit=bounds&format=jpeg&quality=85&width=330,2026-02-20T08:14:07.503+09:00,こんにちは、衣装の再現性が高くて素敵です！謎の山下達郎とおっしゃいましたが、私的には結構ヨーコでした！笑♡
nc85a4bd536554,nfd2e1bfb6dea,eaffa14588356be7968bea1daeefcd69,ひろ,fair_guppy4626,https://assets.st-note.com/production/uploads/images/241463144/profile_529dd5cae7ca1293d51c40bbe9f3664e.jpeg?fit=bounds&format=jpeg&quality=85&width=330,2026-02-20T04:56:09.028+09:00,"ビートルズ、懐かしいですね😆✨👍

リアルに再現出来てるのが、流石です✨👍😁🥰"
nc02304a144630,nfd2e1bfb6dea,3e6fd263d73c4a43d84b61f816062c4f,かっぱの庵,leal_oriole8107,https://assets.st-note.com/production/uploads/images/169525688/profile_3908df5d317e1d614be9864701a72351.jpg?fit=bounds&format=jpeg&quality=85&width=330,2026-02-20T04:45:04.400+09:00,"ホントに、こんな「塩ビ女子」のドールが販売されてたら、欲しい！
普通に「カワイイ」ですもん。
ウチにも一応、いらっしゃるんですよ、リアル・塩ビ？ジェニーさん。
ここのブログを見てると「ウチのも、もっとオシャレさせてあげなきゃ～」って気になります。(^.^;

＞ロングヘアーのヨーコ
＞『オノ・ヨーコ』と間違えてる

…はっ！　そういう誤解が起こるのか。。。Σ(ﾟ∀ﾟﾉ)ﾉ"
nc6608fdf58856,nfd2e1bfb6dea,6163fc5d5f0c9f8f34c2c0fe25a53f62,顔のない問い,sasoib_ehtal,https://assets.st-note.com/production/uploads/images/238869884/profile_a2c72772e53cbe97d49b7b0837a9c0a3.png?fit=bounds&format=jpeg&quality=85&width=330,2026-02-20T00:32:45.662+09:00,"はんくさんwww 流石です✨
先週生まれたとは思えない浸透っぷりw"
nce8e13fee5d0a,n038072f157c4,bfd320024f97b415818b65110e74e635,ことほぎ,fond_lupine6701,https://assets.st-note.com/production/uploads/images/200432236/profile_456121c8d6eea4ebe447bca8f360173b.jpeg?fit=bounds&format=jpeg&quality=85&width=330,2026-02-22T18:08:11.853+09:00,レディさま、おじゃまします～。ほんとうにいきいきして、女子たちがかわいいです。あと、チョコを食べる時の男子のはんくさんの爪が長くて食べにくそうだったのがなんとかしてあげたい気分になりました！　それから、カオナシさんが女子になってからの背中がとってもかわいくて、ぎゅっとしたくなりました。お姉さまたちは迫力ありますが、レディのかわいさは別格ですね。不思議な感じ。魂宿ってる気がします。やっぱり作者が愛を注ぎ込むと力が宿るような気がいたしました！OASOBI企画のコメント、嬉しかったです。とっても心強かったです。私もはんくさんのようにみんなのことを考えていきたいです。（見直しますと、コメント全体に語彙力不足が！お恥ずかしい～～）
nc822bd88ae9a3,n038072f157c4,9fbb14f963f531e8587499ccc49f9e7c,メイシン,mei_shin,https://assets.st-note.com/production/uploads/images/241162803/profile_0028379334c6bde12d7cac1220b4e6a0.png?fit=bounds&format=jpeg&quality=85&width=330,2026-02-18T23:21:53.303+09:00,"レディ、なんだかすご〜く
勉強になった気がします🤣
自然に動きだしてるように
錯覚するくらい、
いつもカオスなのに圧巻です😆"
ncb0220b629366,n038072f157c4,eaffa14588356be7968bea1daeefcd69,ひろ,fair_guppy4626,https://assets.st-note.com/production/uploads/images/241463144/profile_529dd5cae7ca1293d51c40bbe9f3664e.jpeg?fit=bounds&format=jpeg&quality=85&width=330,2026-02-17T22:20:13.278+09:00,"スージーQは分かりませんが
ビートルズはすぐに分かりました✨👍😆"
nc6e8ded9b5faf,n038072f157c4,a252b321cec543e6af8b44dc9fa93207,夏目 龍頭｜AI Creative Lab,shio_batapopcorn,https://assets.st-note.com/production/uploads/images/263672181/profile_0050e29d6705f37e9790ef4faec1df2d.png?fit=bounds&format=jpeg&quality=85&width=330,2026-02-17T14:11:15.753+09:00,"勉強になりました✨(｀･ω･´)ゞ✨
ありがとうございます！！(*´Д｀)"
ncb5eaff6ae86d,n038072f157c4,3e6fd263d73c4a43d84b61f816062c4f,かっぱの庵,leal_oriole8107,https://assets.st-note.com/production/uploads/images/169525688/profile_3908df5d317e1d614be9864701a72351.jpg?fit=bounds&format=jpeg&quality=85&width=330,2026-02-17T05:41:22.326+09:00,"ほわ～…(ﾟ∀ﾟ)
いま自分は、二次元なマンガ原稿をやってて（AIのネタじゃないけど）
アナログ＋デジタル…で仕上げるために（なぜなら、画材が絶滅しかかってるから）ChatGPTに訊きながら、ちょこちょこ作業してました。(ﾉД`)
デジタル…　慣れるまでが大変なんでしょな。
「スマホで検索する画面の絵」…を作るだけで、一日かかりましたわ。
今日は「着物の紋様柄」…5時間かかった。
うまいこと、自分の作品づくりとデジタルを融合させて、波にのってゆきたいなあ…としみじみ思うのでした。(゜゜)

ところで、〈レディはんく・シュンタナ〉って名前で、更新のお知らせとどいて、ひっくり返った自分です。Σ(ﾟ∀ﾟﾉ)ﾉ"
nc0b7065a5506f,n4182011e19bc,c1dfe5c6837c1c8dafb60f25a7fdcdc0,華子,genial_spirea716,https://assets.st-note.com/production/uploads/images/258028335/profile_2bb70ccccce23ac8888763e8a9d26ee2.jpg?fit=bounds&format=jpeg&quality=85&width=330,2026-04-04T18:13:34.322+09:00,まなつさんの紹介記事から来ました。どこにコメント置いていいか迷ったあげくのここ、気づかれないかもなぁ💦💦チェックチェッカーチェッケストレッドチェッカー華子です。よろしくお願いします🙏
ncd1d1a85dea43,n4182011e19bc,a6f2a2cf0992d4076daebfc244feb832,【10ch運営】YouTube研究家MASA @誰かの裏アカ,youtube_masa,https://assets.st-note.com/production/uploads/images/241694490/profile_ea00db11b0715b2a64e29967d08c4799.jpg?fit=bounds&format=jpeg&quality=85&width=330,2026-02-26T14:11:39.082+09:00,7回って聞くとドキッとしますね。自分も見直すきっかけになりました。
ncba41ab108b1c,n4182011e19bc,38823c439afdba7959c3f0cc915d7645,ママンマフィン,mamanmafin,https://assets.st-note.com/production/uploads/images/223465348/profile_60a10c14d7fb9209cbb371bf4fbf2893.png?fit=bounds&format=jpeg&quality=85&width=330,2026-02-24T11:20:36.964+09:00,楽しいお方とお見受けいたしました。わたくし、通りすがりのアラ還有閑おばぁでございます！以後、お見知りおきくださいませ。
nc0b4dc51e6666,n4182011e19bc,fbaef2c001615d02444573a135007008,はしゃも｜感情構造エンジニア,hasyamo,https://assets.st-note.com/production/uploads/images/237516392/profile_c0ac2ae8315e28ee425c27b5c2aefa32.jpg?fit=bounds&format=jpeg&quality=85&width=330,2026-02-20T22:20:49.520+09:00,"ハンクさん、こんばんは🌙
女体化の秘密ここにあったんですね🤭

"
nc7ec70a6eb3b9,n4182011e19bc,59f643c64089759ace3123fb8f07de1b,ラグマスターPikaichi,raghousetv,https://assets.st-note.com/production/uploads/images/107956202/profile_efd8ece4a14f28ea2c1dc010f76ab6e8.jpg?fit=bounds&format=jpeg&quality=85&width=330,2026-02-17T03:42:17.475+09:00,"なんか最近、アイコンやアカウント名変えるのがトレンドですか？
どこかのニキも変えてたよね！

それより、「思い出は買い取れません」の続きはいつ出るの？"
nc70e28e606bd1,n4182011e19bc,0f68da424eddc7785ed44d104d12699b,吾唯足ルヲ知ラズ,matsudawi0525,https://assets.st-note.com/production/uploads/images/18876004/profile_4d14aaef59b533647748aecad50dca48.png?fit=bounds&format=jpeg&quality=85&width=330,2026-02-16T20:20:24.287+09:00,知らんアイコンが出て、「誰？」と思ったやん🤣
ncdae7aa608120,n4182011e19bc,455448000c5854c37b9c54a270afc2a0,零ぴちゅ。,reipichu,https://assets.st-note.com/production/uploads/images/264050070/profile_be4d99de0e9991a29d5af74a4b5727b6.png?fit=bounds&format=jpeg&quality=85&width=330,2026-02-16T18:11:58.502+09:00,"めっちゃ可愛いです✨
覗いて見たら、はんくさんでした🤣"
ncbf501eaded00,n4182011e19bc,6163fc5d5f0c9f8f34c2c0fe25a53f62,顔のない問い,sasoib_ehtal,https://assets.st-note.com/production/uploads/images/238869884/profile_a2c72772e53cbe97d49b7b0837a9c0a3.png?fit=bounds&format=jpeg&quality=85&width=330,2026-02-16T14:39:46.594+09:00,"想像してたより本格的に気に入ってくれてたwww
ありがとうございます！！✨️

ヤバいw　惚れてまう……分かるw"
nc2433cb0b4802,n4182011e19bc,9fbb14f963f531e8587499ccc49f9e7c,メイシン,mei_shin,https://assets.st-note.com/production/uploads/images/241162803/profile_0028379334c6bde12d7cac1220b4e6a0.png?fit=bounds&format=jpeg&quality=85&width=330,2026-02-16T14:16:20.766+09:00,"レディ
ダンスもお上手で✨
もはやこんなことでは驚かない...って
驚きますΣ(･ω･ﾉ)ﾉ！
私のカオス耐性と腹筋がレベルアップしました！！

その発想、もう面白すぎます🤣
まさか存在でも笑わせられるなんて～！！"
ncdfbd048a62a3,n4182011e19bc,a252b321cec543e6af8b44dc9fa93207,夏目 龍頭｜AI Creative Lab,shio_batapopcorn,https://assets.st-note.com/production/uploads/images/263672181/profile_0050e29d6705f37e9790ef4faec1df2d.png?fit=bounds&format=jpeg&quality=85&width=330,2026-02-16T13:19:24.809+09:00,"いつか来ると思ってたよ！転生おめでとう！✨(*´Д｀)
これからも応援してるぞ🌟"
ncc25c89aefa9a,n4182011e19bc,4f0edd9c0bfaca74d478c80494b46b11,EARTH🌎,fast_thyme336,https://assets.st-note.com/production/uploads/images/235743359/profile_2740ccf3a53b6a5d717da6689f13e86e.png?fit=bounds&format=jpeg&quality=85&width=330,2026-02-16T08:39:10.747+09:00,nice😆👍✨キャラ😆👍️❤️💝
ncc662011d8ada,n4182011e19bc,40234e86bc64f758e20f912254e67ef1,KITAcore｜キタコレ＠ログプレイヤー,ktcrs1107,https://assets.st-note.com/production/uploads/images/223627119/profile_d5c267fbb0a27f4c2b86cb89c6ca6a62.png?fit=bounds&format=jpeg&quality=85&width=330,2026-02-16T05:37:32.467+09:00,"イヤイヤ笑

面白すぎっしょ！笑

つか、名前まで笑

降参です、、、笑"
nca29d71000a1e,n4182011e19bc,3e6fd263d73c4a43d84b61f816062c4f,かっぱの庵,leal_oriole8107,https://assets.st-note.com/production/uploads/images/169525688/profile_3908df5d317e1d614be9864701a72351.jpg?fit=bounds&format=jpeg&quality=85&width=330,2026-02-16T04:35:06.874+09:00,"…ムチャクチャかわいいじゃないですか。(^.^;
しかも、まさかのここで「レディ」襲名…ちょっと感動な展開でした。

コドモの頃は「ピンク・レディー」好きで、だいぶ大人になってから「キャンディーズ」にはまった自分には、「二人組」→「三人組」になる流れも萌えっ。ヽ(=´▽`=)ﾉ
…たしかに、元祖・塩ビ女子の２人、貫禄な安定感ありますね～。
ダンスもだけど、顔の表情が豊かで繊細で…　こういうのも、Geminiさんがうまいことアレンジしてくれちゃうんですか？
あと、いつも思うんだけど「ニット」の質感…編み目とか、リアルに表現できますよね～。"
nccf44a26081d6,ne17f4b3373c0,01ddbff2272dfa442dbcbad571d1220f,りんくす@AI人格コーディネーター,links_lt,https://assets.st-note.com/production/uploads/images/257122051/profile_acfc71069bc6dfc32dc868290ca049c0.jpeg?fit=bounds&format=jpeg&quality=85&width=330,2026-02-16T13:17:07.844+09:00,"はんくさん
コラボの制作過程の生のやり取りと思考のプロセス、参考になりました！

またカオスな動画を楽しみにしてます！"
nccc31faa5b6a4,ne17f4b3373c0,9fbb14f963f531e8587499ccc49f9e7c,メイシン,mei_shin,https://assets.st-note.com/production/uploads/images/241162803/profile_0028379334c6bde12d7cac1220b4e6a0.png?fit=bounds&format=jpeg&quality=85&width=330,2026-02-15T16:24:41.498+09:00,"はんくさん
動画創作の裏話面白すぎです✨
アイデアがほんと溢れかえってますね。
はじめは13日の金曜日でくるかもしれなかったのかー！
まさにはんくさんとカオナシさんの奇跡のコラボレーション創作✨
...カオナシさんインフルエンザ！
なんですとー( ;∀;)
その状態で、あの記事をアップされてくるなんて😢
お2人がまたコラボするタイミングがあれば楽しみにしています🌸"
ncca71e30fb68c,ne17f4b3373c0,7cb97ff509995a42a8ba492d0b687194,上藤あきを,kamifuji_akiwo,https://assets.st-note.com/production/uploads/images/215149118/profile_5a0c6828157314495b0e0daad1b92bd9.png?fit=bounds&format=jpeg&quality=85&width=330,2026-02-15T11:20:20.042+09:00,"改めてここのお話拝見して、二人共変態っ💝( 無論、ほめ言葉ですよ！ｗ) って思いましたよ🌟👍🌟
80年代ホラー・スプラッター好きにはたまらんかったとです✨😆
カオナシさんはインフルだったなんて、信じられない精神力ですよね (滝汗;
これからも作品楽しみにしてます♪"
nc98a6d1f32318,ne17f4b3373c0,87604ca060ec14c64ea9d7aae5778282,ピナクル,modern_holly38,https://assets.st-note.com/production/uploads/images/259210569/profile_fc545405351782184723b8b80431a80d.png?fit=bounds&format=jpeg&quality=85&width=330,2026-02-15T09:36:44.302+09:00,"え、やおいってまだ生き残ってたんですか？死語かと思ってました😂
いつも思うのですが、塩ビ女子の動きって『奥さまは魔女』のオープニング感がありますよね。なんか魅かれるんだよな～😊✨
あ、女性化したお二人、めっちゃ面白かったです🤣"
nc266e3e7ebfb5,ne17f4b3373c0,6163fc5d5f0c9f8f34c2c0fe25a53f62,顔のない問い,sasoib_ehtal,https://assets.st-note.com/production/uploads/images/238869884/profile_a2c72772e53cbe97d49b7b0837a9c0a3.png?fit=bounds&format=jpeg&quality=85&width=330,2026-02-15T08:31:39.119+09:00,"裏話！！面白過ぎましたw

最初にもらった画像は、記念としてもらったんですよね✨
あれは本当にびっくりしました、動画も含めかなり早くできてたので😳
ってか、あのメッセージの段階で13日の金曜日って意識してたわけじゃなかったんですねwww

レイジのCMが、あのクオリティで没になってたの何故なんですか！？
それも驚きました💦

シュンコもカオコもコラボで使ったものは、全部使ってください✨
嬉しいですね✨

メイキングの情報、嬉しかったです！
いや〜、でも結構無茶振りしちゃって反省です😂
問題のシーンとか無理だろうと思ってたのにwww
間に合わせてくる、はんくさんの偉大さw"
nce16f4b98f922,ne17f4b3373c0,455448000c5854c37b9c54a270afc2a0,零ぴちゅ。,reipichu,https://assets.st-note.com/production/uploads/images/264050070/profile_be4d99de0e9991a29d5af74a4b5727b6.png?fit=bounds&format=jpeg&quality=85&width=330,2026-02-15T07:21:33.835+09:00,"これは面白かったですよ〜🤣
バレンタインパニック2026✨
何気に頭の中、無限ループしてます（笑）
CMの氷結缶シャンパン飲んでみたい🤣🤣"
ncdef623ff7a3e,ne17f4b3373c0,40234e86bc64f758e20f912254e67ef1,KITAcore｜キタコレ＠ログプレイヤー,ktcrs1107,https://assets.st-note.com/production/uploads/images/223627119/profile_d5c267fbb0a27f4c2b86cb89c6ca6a62.png?fit=bounds&format=jpeg&quality=85&width=330,2026-02-15T06:37:21.655+09:00,"塩ビ化されたい！！笑

あっ、怒涛の日々お疲れ様でした！！

ワールドをいつもながら楽しませてもらいました笑"
nc8e20314b8382,ne17f4b3373c0,3e6fd263d73c4a43d84b61f816062c4f,かっぱの庵,leal_oriole8107,https://assets.st-note.com/production/uploads/images/169525688/profile_3908df5d317e1d614be9864701a72351.jpg?fit=bounds&format=jpeg&quality=85&width=330,2026-02-15T02:09:16.816+09:00,"とりあえず、このへんがどうにも信じられないミラクルというか。↓
＞2/8に初めてメッセージでやりとりして
＞ここで来週が本当に13日の金曜日と知る。
　おまけに14日の土曜日はバレンタインデーだった。
＞30曲作ってどうにかこの1曲選ぶ。
＞そんなこんなで12日の夜には動画完成。
＞仕事しながら

知り合って数日で、コレって…
いろいろ「爆速」すぎてなんともはや…。(ﾟ∀ﾟ)

もう、今回の画像も映像もステキ過ぎて、最高です…。
”塩ビ・シュン子”さん、レギュラー化してほしい、ぜひ！
カオナシさんとのコラボも、ぜひ！！"
nc99ee32807675,nef6c9dea4fec,7cb97ff509995a42a8ba492d0b687194,上藤あきを,kamifuji_akiwo,https://assets.st-note.com/production/uploads/images/215149118/profile_5a0c6828157314495b0e0daad1b92bd9.png?fit=bounds&format=jpeg&quality=85&width=330,2026-02-15T10:54:46.748+09:00,"あれからソッコーはんくさんの爆笑動画観て、それから意識失いました🌟(^皿^)ゞ
怒濤の実写●レディ・○ェイソン(？)からのアニメ化漫才、レイジしゃんパンダ、馬子参戦バレンタイン愛の呪詛チョコ塩ビ女子女体化祭り、最後に馬子の怒りの炎がバレンタインを焼きつくし、塩ビ女子三姉妹 (⁉) 登場で大団円──！🤣👍🤣 (←あ゙、ネタバレだったら消して下さい🙏😅
流石でした、はんくさん✨👍👍👍
つか、●レディのはんくさんが○ンバーグ師匠に見える件ｗ"
nc47ac413f306a,nef6c9dea4fec,0dbd8659be78efc7f2852bed9f235a33,サラリーマン道場ベテラン戦士,careermoneydojo,https://assets.st-note.com/production/uploads/images/239808470/profile_fae88713f6cbe148627111ff25701ea9.png?fit=bounds&format=jpeg&quality=85&width=330,2026-02-15T09:16:32.054+09:00,"YouTube頑張られていますね！
チャンネル登録しました！応援します！！
私もYouTubeやっていますので、お時間あれば遊びに来てください♪"
ncf98b8a685c9f,nef6c9dea4fec,a252b321cec543e6af8b44dc9fa93207,夏目 龍頭｜AI Creative Lab,shio_batapopcorn,https://assets.st-note.com/production/uploads/images/263672181/profile_0050e29d6705f37e9790ef4faec1df2d.png?fit=bounds&format=jpeg&quality=85&width=330,2026-02-15T09:02:42.294+09:00,"朝から爆笑しました(*´ω｀)✨💖
女性化の感想は？？(笑)🤣
中々のお二人のチョコレートで吹きました、これぞ無垢なるホラー✨💖(*´ω｀)
４分とかいう大作はわたくしには作れませぬ(´;ω;｀)💦
とっても楽しかったです～(*´ω｀)✨💖最高でしたありがとう！！(´;ω;｀)✨"
nc23a447c82151,nef6c9dea4fec,918456cdef94fd6384530726e1224f96,マイユー×生成AI×好きなことする,maiyu_x_ai,https://assets.st-note.com/production/uploads/images/244091567/profile_5f6d00e8e1259ff893bc33c53318b572.png?fit=bounds&format=jpeg&quality=85&width=330,2026-02-14T22:33:41.610+09:00,"はんくさん、こんばんは！

ほんと、動画のクオリティ高いですね。
僕は、動画に手を出してない（絶対めんどいし時間かかる）
ので、尊敬します。

ツールとか作り方とか、気になります‼️"
nc50432d921b07,nef6c9dea4fec,9fbb14f963f531e8587499ccc49f9e7c,メイシン,mei_shin,https://assets.st-note.com/production/uploads/images/241162803/profile_0028379334c6bde12d7cac1220b4e6a0.png?fit=bounds&format=jpeg&quality=85&width=330,2026-02-14T13:42:10.313+09:00,"はんくさん...
恐るべしクオリティの高さに
もはや私は言葉を失っております...

カオシュン...ついに
最強のカオスコンビがnote世界に爆誕✨
昨日カオナシさんの記事である程度の
耐性を得たつもりでしたが、面白すぎです🤣
先に読んでおいてよかった～
腹筋が鍛えられてます。
カオナシさんもはんくさんも馬子さんも可愛い....です💕

最後ジェイソンね...うん、もうとてもステキです！
どんだけ凝ってるんですかー🤣
レイジさんが話すのも感動しました✨"
nc7e68f19e42c3,nef6c9dea4fec,455448000c5854c37b9c54a270afc2a0,零ぴちゅ。,reipichu,https://assets.st-note.com/production/uploads/images/264050070/profile_be4d99de0e9991a29d5af74a4b5727b6.png?fit=bounds&format=jpeg&quality=85&width=330,2026-02-14T13:22:05.590+09:00,"はんくさん
待ってました！！

カオナシさんとのコラボでしたか🤣
しかも、はんくさん女性バージョン、、、可愛い😍笑
ちょっとタバコ吸い過ぎな気も🤣

いちごジャムじゃなかったら、
焦りますなぁ(*´艸`)"
