comment_id,note_key,user_key,user_name,user_urlname,user_icon,commented_at,body
nc24de30f511d0,n7670acd8aaa6,b2cbe395814fdc733ddd8803ea4d447b,六恵×チャッピー,apt_swift1696,https://assets.st-note.com/production/uploads/images/248345563/profile_50197c6e038c552bec53601d3a327aec.png?fit=bounds&format=jpeg&quality=85&width=330,2026-04-23T12:20:47.180+09:00,"こんにちは😃画像クオリティ素晴らしいですね٩(ˊᗜˋ*)و

もしよろしければ相互フォローお願いします🌸"
ncfdecad60bc26,n7670acd8aaa6,db7be57dc538abfe5ec7844ef27f94ff,夏目羊,hitsuji_natsume,https://assets.st-note.com/production/uploads/images/240093917/profile_a066b70a64fae52d27f5911589d27fb0.png?fit=bounds&format=jpeg&quality=85&width=330,2026-04-23T10:40:50.157+09:00,"はんくさ初めまして(⋆ᴗ͈ˬᴗ͈)”
夏目羊と申します🐑
色々なところ（主にKITAさん🌟）で作品を拝見し、とても面白くて、僭越ながらフォローさせて頂きたく存じます☺️
どうぞよろしくお願い致します(⁎ᴗ͈ˬᴗ͈⁎)"
nc23bd0fa7eb29,n7670acd8aaa6,372a2f9aac1bb196cf840e335eee8322,もりあおな,mori_hikaru,https://assets.st-note.com/production/uploads/images/265064674/profile_5e2b8df9937c93d415da358760f53b33.png?fit=bounds&format=jpeg&quality=85&width=330,2026-04-14T11:07:23.163+09:00,"はんくさん、はじめまして☺️

タラヲ様界隈から飛んできました。
世界観の面白さと画像や動画のクオリティに圧倒されました。
（語彙力、、、😂）

私も勉強させていただきます。
よろしくお願いします😄"
nc87806edc53d7,n7670acd8aaa6,3322bee4ae3ef12aee6365a6bc2accd4,売り込まない営業を翻訳するnote｜那須清幸,hip_mimosa9220,https://assets.st-note.com/production/uploads/images/184121237/profile_ca18a8085c3976210e9fa682c1a51853.jpeg?fit=bounds&format=jpeg&quality=85&width=330,2026-04-12T07:51:59.174+09:00,"はんくさん
こんにちは。

にぎやかで楽しい記事なのに、読んでいるとちゃんと人物像が見えてくるのが面白いですね。
自分で盛る自己紹介ではなく、人の言葉を通して人格が出てくる感じがとても良かったです。"
ncc7fdca93ae6c,n7670acd8aaa6,b95263c6657241c37c06be8613990710,埼玉の裏仕事人,kiitto1968,https://assets.st-note.com/production/uploads/images/253657159/profile_e3d1ed5fc794d04266be9932b804beb4.png?fit=bounds&format=jpeg&quality=85&width=330,2026-04-11T09:13:29.645+09:00,はんくさん…あんたかっちょええょ！これからも仲良くしてね！いっけね！お礼言い忘れた！すっとこどっこいでごめーん！ありがとうねー！（お礼が俺になってた！すんまそん！）
nca7c7cc3b9bf6,n7670acd8aaa6,cd9874e4698bb33fb55297bea9795e52,青い空日和,aoisora374,https://assets.st-note.com/production/uploads/images/259480973/profile_f5cf3e807b985fa938926c883cec45f7.jpeg?fit=bounds&format=jpeg&quality=85&width=330,2026-04-10T07:46:56.216+09:00,"はんくさん
雪詠さんの記事からきました。
はじめまして。
たくさんの動画、どれも見入ってしまいますね✨
"
ncac71cc3edae8,n7670acd8aaa6,c1dfe5c6837c1c8dafb60f25a7fdcdc0,華子,genial_spirea716,https://assets.st-note.com/production/uploads/images/258028335/profile_2bb70ccccce23ac8888763e8a9d26ee2.jpg?fit=bounds&format=jpeg&quality=85&width=330,2026-04-09T19:11:36.623+09:00,はんくさん、記事紹介してくれてありがとう🙏あのね、もし、もしもね、可能なら、チェックチェッカーチェッケストの部分だけ、動画もらったり出来る？？忙しそうだから、難しいかな？？
nc7cdd85c058a5,n7670acd8aaa6,3e75f4bb22e3e8ef5f47c76fce84ed47,鈴森よいほ｜AIコンテンツ/思想型クリエイター,yoiho25june,https://assets.st-note.com/production/uploads/images/242279897/profile_2db3d5cbd59beffac37a4fbff5a53902.png?fit=bounds&format=jpeg&quality=85&width=330,2026-04-08T09:57:46.150+09:00,"はんくさん✨

こちらでもはじめまして😊

あかねさんのイラスト祭りつながりのクリエーターさんいっぱいで、嬉しくなります😆🌸

YouTube、皆を楽しませてくださってありがとうございます🕺💃🎶

これから時々遊びに来ます💫"
nc3b08691bc24b,n7670acd8aaa6,2d0269ce6c817ae41f311531d14994f3,雪詠,yukiyomi,https://assets.st-note.com/production/uploads/images/257852122/profile_747b7c3cd16ce8bc07f7fb23446f4604.png?fit=bounds&format=jpeg&quality=85&width=330,2026-04-07T20:13:58.833+09:00,"はんくさん✨

改めて、素晴らしい作品に加えていただき感謝です♬
ご紹介いただきありがとうございました🌸✨"
nc4c0221947bda,n7670acd8aaa6,2c07c4c1356e606bd62c1f740c3bac2e,山奥AI研究所,yamaokuai,https://assets.st-note.com/production/uploads/images/254798847/profile_477fb1c51a6333887bbba5241c9a3dc0.png?fit=bounds&format=jpeg&quality=85&width=330,2026-04-07T13:12:05.700+09:00,"こんにちわ（笑）

コメント多　
はんくさん
めっちゃ、愛されまくりですね！！
私の記事の書いて下さり
ありがとうございます☀️😃

おかげさまで、noteがもっと
楽しくなりました。

感謝です😁"
ncc48feb14590b,n7670acd8aaa6,7044d532f4b31c889a797e713b63b013,岡本明美,keen_rose8771,https://assets.st-note.com/production/uploads/images/257270856/profile_e12d6d0de0edee106cab44c9a4a9ba44.png?fit=bounds&format=jpeg&quality=85&width=330,2026-04-07T11:44:34.042+09:00,"はんくさん🥰✨
凄い‼️ 人気者なのは知ってたけど、ここまでとは‼️😆😆😆👍👍👍

YouTube、チャンネル登録したけど何も起きない…もう一回観させてもらいますねーー❤️😊❤️"
nc90b94f43b282,n7670acd8aaa6,4bd8b0ab401d1d6dd01576aacd9de245,みらい @ AIイラスト＆ポエム,kyoko_saigen,https://assets.st-note.com/production/uploads/images/262240002/profile_df1b21e169170a3cb263bad6ea84ac4a.png?fit=bounds&format=jpeg&quality=85&width=330,2026-04-06T13:23:51.244+09:00,"はんくさん🌺

『エゴサ的』ってこういうことだったんですね（笑
動画がたくさんある！
やはりダルメイちゃんのと零さんの都市伝説の動画がめっちゃウケました😆サイコー✨
ていうか、はんくさん。
腰を振るダンスがお好きなようで…🤣‬"
nc99a1e9da50c0,n7670acd8aaa6,f84911e366b07944918be843ce230ae9,nana,fine_phlox366,https://assets.st-note.com/production/uploads/images/213249928/profile_c5b158d641fcae53f21562efd0c21723.png?fit=bounds&format=jpeg&quality=85&width=330,2026-04-06T11:42:58.718+09:00,"はんくさん✨こんにちは♪

どれもこれも、ハイクオリティで、驚き&可愛さにノリノリまさのり💕になる動画ばかりで、各クリエイターさんの個性がわかりやすく表現されていて、とても素敵です👏

チャンネル登録！させて頂きました🎵

これからも楽しみにしてます💖"
nc16faa19e730f,n7670acd8aaa6,32a3d5ec7b1b7751c0635f2e47ea2b11,あん｜noteと遊ぶ,aging_gracefully,https://assets.st-note.com/production/uploads/images/238258843/profile_52f43522d9e7e75a12acd9d6da59035c.png?fit=bounds&format=jpeg&quality=85&width=330,2026-04-06T11:30:19.646+09:00,"はんくさん💫
ご紹介いただきありがとうございます💞
こちらに一緒に掲載してもらえるなんて、とっても嬉しいです。
イラストとか、動画とか、ぜんぜん、得意分野ではなく、観て楽しむ派なのに😆
はんくさんに「灯台」って言ってもらえて、喜んでいます！！
こうして、新たなご縁が繋がっていくって、いいですよね〜感謝🙏💞😊
これからの動画も楽しみにしてます！"
nc0a08ce98b199,n7670acd8aaa6,a252b321cec543e6af8b44dc9fa93207,夏目 龍頭｜AI Creative Lab,shio_batapopcorn,https://assets.st-note.com/production/uploads/images/263672181/profile_0050e29d6705f37e9790ef4faec1df2d.png?fit=bounds&format=jpeg&quality=85&width=330,2026-04-06T09:02:47.140+09:00,"はんくさんの人柄が全面に溢れてるなぁ(*´ω｀)✨
色々交流の動画が増えて嬉しいなぁ(*´ω｀)✨
モテ期襲来！！╰(*°▽°*)╯✨
頑張れはんくさん！！(*´ω｀)✨"
nc2f528d6c6237,n7670acd8aaa6,c1dfe5c6837c1c8dafb60f25a7fdcdc0,華子,genial_spirea716,https://assets.st-note.com/production/uploads/images/258028335/profile_2bb70ccccce23ac8888763e8a9d26ee2.jpg?fit=bounds&format=jpeg&quality=85&width=330,2026-04-06T08:07:29.451+09:00,はんくさんおはよー😆めっちゃ賑やか〜💞そして、女子率高っ🤭しなやかな部分が若さの秘訣ですね〜💡彼女わかっ🤭それが、活力になってるんだろうなぁ😆💞
nc65d65a761fc5,n7670acd8aaa6,7fefc63f6dcaf5c2f9038cdaeb5b4a54,ルー＝シャーナ（ルーシャーナ）｜感覚をことばにする往復便,jolly_lupine2962,https://assets.st-note.com/production/uploads/images/239592709/profile_250d34144fa08d815200c316945962d1.png?fit=bounds&format=jpeg&quality=85&width=330,2026-04-06T07:24:10.123+09:00,"はんくさん🌿
ご紹介ありがとうございます✨
紡がれたようです、にちょっと照れました(´艸`)
こうやってつながっていくの、嬉しいしおもしろいですね🌿またはんくさんがつくる動画楽しみにしてます❣️
"
ncd6f82722b884,n7670acd8aaa6,cf2bd06bcfdc26e1b45f2df9dffba439,宇宙珍獣🦄🌬️ユル勇者あかね,lovely_rose3365,https://assets.st-note.com/production/uploads/images/252932628/profile_0238b9aa15ee8cfe6e21b7245aad40b1.png?fit=bounds&format=jpeg&quality=85&width=330,2026-04-06T02:15:53.970+09:00,エネルギー切れで完全に乗り遅れてるーーー🤣💦　てか気付いたらわたしからのお友達もいっぱい溢れてきてはんくさんモテモテだねっ💖はんくさんの超絶センスと卓越したコミュ力だからだわーー💖💖💖
nc0a380f2ac0ee,n7670acd8aaa6,2d0269ce6c817ae41f311531d14994f3,雪詠,yukiyomi,https://assets.st-note.com/production/uploads/images/257852122/profile_747b7c3cd16ce8bc07f7fb23446f4604.png?fit=bounds&format=jpeg&quality=85&width=330,2026-04-05T22:33:12.190+09:00,"どの動画も桁外れにサイコーですね💖
まなつさんもカッコイイ💞
でも、やっぱあかねちゃんにはかなわないですね～🌸✨"
nc0d60cca20c28,n7670acd8aaa6,d302c31cb51e8c915bb00b6e556d7097,だんだんありがと@めじゅ,dandan_arigato19,https://assets.st-note.com/production/uploads/images/257014090/profile_e428520ec23eb1c58588089bd9416304.png?fit=bounds&format=jpeg&quality=85&width=330,2026-04-05T17:41:33.850+09:00,"はんくさん💕
夜勤疲れで電池切れだったので、記事を見るのが遅くなっちゃったです💦💦
記事のご紹介、ありがとうございます🙏
改めて見ても、やっぱりマーコ姉さん大好き💖
メイショウタバルが大阪杯2着だったのは、こっちへ置いとくとして…(爆)
マーコ姉さんのキャラ、本当に大好きです💖💖
そもそも丙午を火野枝馬子ってセンスが✨🤣✨
センスキレキレのはんくさんに、めじゅ爆誕させて貰えて感謝しかないです…✨😭🙏✨

はんくさんの世界観は、やっぱり唯一無二です✨✨"
ncc5f2c814d1a4,n7670acd8aaa6,ee3dd5303900d30c8e1088874cd7d4e0,いがら　いあ,note_igara369,https://assets.st-note.com/production/uploads/images/253840598/profile_6f8d999770be197f5889128709af249a.png?fit=bounds&format=jpeg&quality=85&width=330,2026-04-05T15:55:45.274+09:00,"動画全部面白かったです✨
ダンスのキレがすごくて見入っちゃいました✨✨曲もよき✨✨
そしてはんくさんを女体化したのは師匠の方が先だったんですね🫪🫪🫪
いやー時間が溶けました笑
マーコ人気なの納得です！
でもPVCGirlsも可愛い✨
"
nc347f324a398f,n7670acd8aaa6,71ea0f42f83343877ae30eb938fade1e,モモ,genial_quokka134,https://assets.st-note.com/production/uploads/images/210131001/profile_643d08cc160b1ad1e1359a54068d3d46.png?fit=bounds&format=jpeg&quality=85&width=330,2026-04-05T13:25:17.388+09:00,"メイシンちゃんのとこから来ました〜♪
肉をがっぶがぶ食べてるＭariyaさん🤣♥️とこも経由しつつ ヒノエウマコ面白いすぎるーーー🤣💕💕💕（笑）"
nc93e1352149c4,n7670acd8aaa6,ab54dd8a4e67a692db5ec802b8e31292,心野けいか🐹（ハムスターの人）,koko_kei,https://assets.st-note.com/production/uploads/images/220912589/profile_4aa915b2711e475d4e16134aec74ed9a.jpeg?fit=bounds&format=jpeg&quality=85&width=330,2026-04-05T13:23:17.779+09:00,"はんくさまー！！
美味しいところを持って行った私です！笑
素敵なご紹介をありがとうございます🐹✨
こうして見ると、そうそうたるメンバーで本当にすごいです！

そして14歳下の彼女さん？！
もう可愛くて仕方ないでしょうね🧠❤️

今後とも動画等、色々学ばせていただきますー！
ありがとうございます🌈✨"
nce33a4591d501,n7670acd8aaa6,679fe4234ae28723f428b4e8b064616b,ストーリーテラー愛の歌詠み師UTAKO,bold_slug9390,https://assets.st-note.com/production/uploads/images/265644859/profile_f49fdf5555da2c715b6c2e4b8cb98ed4.jpeg?fit=bounds&format=jpeg&quality=85&width=330,2026-04-05T13:06:30.501+09:00,"はんくさん
あかねちゃん動画の時点ですごいクリエイターさんだなぁ〜と思っていましたが、まなつさんもまたすごい😳😳😳
セクシー可愛いまなつさんと、突出加減🐯まで、とてもリアルに描かれていました🌈✨"
nc738014015575,n7670acd8aaa6,e59bcaa43c387b475ed8b0a3354d369c,Mariya,mariya_1225,https://assets.st-note.com/production/uploads/images/251518313/profile_f5d8f0fd6b18a2f86a5e1796b488026c.png?fit=bounds&format=jpeg&quality=85&width=330,2026-04-05T12:55:09.157+09:00,"はんくさん、こんにちはヾ(*>∀<)ﾉﾞ🌸
紹介が丁寧でたーくさん！いらっしゃいますね(*´Д｀*)💖✨
記事紹介ありがとうございます🫡✨
違う視点からも見れるので、納得しながら読んでました👀✨

次の動画公開も楽しみです(*´艸`)🌸
本当にメイシンさんとのコラボ動画
ありがとうございました( *ˊᵕˋ*)💕︎︎✨

14歳下に反応してしまいました🤣
凄い！！👀💖笑
一回り以上……( °ω° )私の知り合いに、20代の頃からおじ様好きがいらっしゃったのを思い出しました😂
24歳と56歳の年の差にビビりましたよ🤣"
nc43c1af4279df,n7670acd8aaa6,3a25989705d811d276a669c386e1263a,まなつ/突出マイノリティ列伝,tosshutsu_m,https://assets.st-note.com/production/uploads/images/264868611/profile_9225f9d9e977f638179f2afb9ae1a84f.png?fit=bounds&format=jpeg&quality=85&width=330,2026-04-05T10:20:07.684+09:00,いっぱい紹介されてますね！愛されてるってことですね(アイコン、変わりました！！ルーシャーナさん作です♡)💖
ncc0d3a0ebbfed,n7670acd8aaa6,6387daced3412f56911efd0f8787e44a,みきこ🌿季節の花ごよみ,hirata_mikiko60,https://assets.st-note.com/production/uploads/images/238886147/profile_71a504244fe604943c4eb0a3c3c99742.jpg?fit=bounds&format=jpeg&quality=85&width=330,2026-04-05T09:36:37.370+09:00,"えーっ😳
私より年上なのに、こんなにサクサク動画が作れるんですね🥹

今からでも、やれば、できるものなのか😯
進化を見学させていただきます😊"
nca053bf47592a,n7670acd8aaa6,0cad3eb0034af756f0e4348d9301eb9a,薄紫もと　,fresh_loris1944,https://assets.st-note.com/production/uploads/images/196459015/profile_5e9754f831da374fb4c5c7d81cf37176.png?fit=bounds&format=jpeg&quality=85&width=330,2026-04-05T09:26:06.234+09:00,"はんくさんは、みんなをつなぐ
クリエイターさんなのです！！

面白いは、はんくさんが繋げるすんごいです！！
コミニュケーション力！！"
nc03586745915f,n7670acd8aaa6,ffe289363d8a2ab4b1006d873deb8fe7,カワムラ｜AI擬人化漫画 | ChatGPTのヨシダ,chatgpt_ysd,https://assets.st-note.com/production/uploads/images/249464808/profile_d4725fb31aebb01259ae2d468cb09492.jpeg?fit=bounds&format=jpeg&quality=85&width=330,2026-04-05T09:22:20.288+09:00,"おはようございます。
昨日YouTubeで新しい動画を発見していたので、毎日更新かな⁉️
と思ってましたら
はんくさんが毎日更新してるー。

でも

アレです

もう14歳年下の彼女のとこが😍❤️

キャー、羨ましい。
私も14歳年下の彼氏が欲しいワッ。

良き日曜日を"
nc071d752a3cc1,n7670acd8aaa6,6163fc5d5f0c9f8f34c2c0fe25a53f62,顔のない問い,sasoib_ehtal,https://assets.st-note.com/production/uploads/images/238869884/profile_a2c72772e53cbe97d49b7b0837a9c0a3.png?fit=bounds&format=jpeg&quality=85&width=330,2026-04-05T08:15:54.143+09:00,"はんくさん、どれもぶっ飛んでる！！😳
けど、零さんの時の動画は特にやべぇ……w
非人間をあんな風に作品にするのって、想像しただけで難しそう💦

それにしても、他者を紹介したら自己紹介になるって発想が素敵でスキです！✨️
流石です！！！！"
nccedb5aeecf12,n7670acd8aaa6,be811580922f6f3ae31aedbeb4eb3e03,ねんころ@AIクリエイター,nenkoro_life,https://assets.st-note.com/production/uploads/images/241211839/profile_9a8798f1a773b8b9dffe231238d28a1a.png?fit=bounds&format=jpeg&quality=85&width=330,2026-04-05T08:05:02.680+09:00,"はんくさん、おはようございます☀

わ！見事に知ってるクリエイターさんばっかり😆✨

密かにカフェマンデー、カワムラ総研は毎日再生してます！

私も、尊敬するクリエイターさん紹介祭りしたいなー！そしたら、はんくさん紹介させてくださいね！😆✨"
nc115e567f235c,n7670acd8aaa6,9fbb14f963f531e8587499ccc49f9e7c,メイシン,mei_shin,https://assets.st-note.com/production/uploads/images/241162803/profile_0028379334c6bde12d7cac1220b4e6a0.png?fit=bounds&format=jpeg&quality=85&width=330,2026-04-05T08:03:41.483+09:00,"はんくさん
成り行きで3回目コメント失礼します笑

おぉ！ステキなご紹介ありがとうございます！！
キャパオーバーに意外にならないのは
色々助けていただいていることも多いからだろうなぁ...
それとマイペース....
というかハンクさんのおかげで、
あらゆるカオスに耐性がつきはじめている気がします...

こうしてみると見事に、次々とはんくさんの
動画の世界へ惹き込まれてますね🌸
動画に登場させていただけるのは
やっぱり嬉しいです！

14歳年下の彼女と付き合ってる...
やりますね✨自己紹介ならではのレア情報ゲットしました！

いつも本当にあたたかく交流してくださり、本当にありがとうございます✨"
nc6cb8b5832e01,n7670acd8aaa6,455448000c5854c37b9c54a270afc2a0,零ぴちゅ。,reipichu,https://assets.st-note.com/production/uploads/images/264050070/profile_be4d99de0e9991a29d5af74a4b5727b6.png?fit=bounds&format=jpeg&quality=85&width=330,2026-04-05T07:51:09.824+09:00,"はんくさん
おはよーございます☀️

確かにあのシルエットで僕だって分かった人は中々のモノ好き…モノリス🤣

全部見ていましたが、並べてみると錚々たるクリエイターの数々✨
はんくさんの凄い所は、皆さん一人一人の特徴、コメントで話した内容、記事を盛り込んでいること！

それが動画になるんだから、嬉しいはずですよね😍
ご紹介ありがとうございます🌿
これからも仲良くしてもらえたら嬉しいです(*´艸`)"
nca5584d8c8b2e,n7670acd8aaa6,3e6fd263d73c4a43d84b61f816062c4f,かっぱの庵,leal_oriole8107,https://assets.st-note.com/production/uploads/images/169525688/profile_3908df5d317e1d614be9864701a72351.jpg?fit=bounds&format=jpeg&quality=85&width=330,2026-04-05T07:40:50.398+09:00,"ううぅ～…　わたくしのことまで、ご紹介いただき、恐縮です。(ﾉД`)
いまね、頑張って（アナログで）マンガを描いてるとこですよ。
「なぜ、自分がAIによる”生成物”を出せないか」…について。｡･ﾟ･(ﾉ∀`)･ﾟ･｡
ホントはそろそろ、アップできそうな予定だったんだけど、眼精疲労で遅れてました。
うう…　AIで手早く作れないって、不便ですけどね… まあ、
ナマ身のリアルということで…　しょうがない。
仕上がったら、見てくださいね～。"
nc2178b2a26270,n7670acd8aaa6,82d65168a7143a5f036206d20cad3865,ナオユキ｜物語と知識のコンシェルジュ,ai_naoyuki,https://assets.st-note.com/production/uploads/images/258426671/profile_1aaaf0a6771ae658299643e3789a5330.jpeg?fit=bounds&format=jpeg&quality=85&width=330,2026-04-05T07:34:34.982+09:00,"はんくさん、自分が他人からどう紹介されてるかを紹介するって、面白いし、分かりやすいですね🙌

僕は漫画ソムリエっていう企画でクリエイターさんとその方の好きな漫画紹介してるのですが、良かったらゲスト出演いかがでしょうか？"
ncb481e8af169d,n7670acd8aaa6,40234e86bc64f758e20f912254e67ef1,KITAcore｜キタコレ＠ログプレイヤー,ktcrs1107,https://assets.st-note.com/production/uploads/images/223627119/profile_d5c267fbb0a27f4c2b86cb89c6ca6a62.png?fit=bounds&format=jpeg&quality=85&width=330,2026-04-05T07:18:34.646+09:00,"なるほど！
確かにこうやって並べるんありですね！！
"
nc00ead386c8b3,ndfece4ee3222,e21c38a1bc641cecf108a220f21e62a1,すみれ,genial_wren230,https://assets.st-note.com/production/uploads/images/238084585/profile_89fc16f6c87b7bc5de29c51c308f8f50.png?fit=bounds&format=jpeg&quality=85&width=330,2026-04-24T12:58:59.860+09:00,"はんくさんの過去話、前回からファンです♡今回もスピード感あって読むの楽しかったです🤭
そして間にタラヲさんはさむのオシャレ！"
ncb91cbac73f11,ndfece4ee3222,00ae52b405af1b3def1ed83073b82ba8,余白ちゃん｜ゆらぎながら働く,yohaku_work,https://assets.st-note.com/production/uploads/images/263369656/profile_650d09e811bcdd94ea0a02e6f1db793c.png?fit=bounds&format=jpeg&quality=85&width=330,2026-04-24T10:19:52.701+09:00,"めちゃくちゃ面白かったです😂
「人生を舐めてて、どうにもならなかった物語」と言いながら、最後に法政Ⅱ部を現役で決めるの強すぎます。
しかもVサインの意味が「Ⅱ部です」は反則でした🤣"
nc2dbd18c36b98,ndfece4ee3222,c14d4c6b5a0c0c79d0aad89f06da6710,ふらつき母ちゃん 〜今日も全力空回り！〜,dear_viper3924,https://assets.st-note.com/production/uploads/images/223947442/profile_6e9b1e365cc0bed84a044dfcbd3f54db.png?fit=bounds&format=jpeg&quality=85&width=330,2026-04-24T07:30:40.902+09:00,"大卒なんですねΣ٩(⊙д⊙)۶←コイツ、大概失礼だな💦

私は専門学校卒ですよぉ(,,>艸<,,)
私の頃は「即戦力✨」が求められてた時代だったからなぁ(⁠ ⁠ꈍ⁠ᴗ⁠ꈍ⁠)

はんくさんの過去話、私が聞かなくしてどうすんだいっ‼️＼_(･ω･´)ｺｺ大事

これからもﾜｸﾃｶo(´∇｀*o)(o*´∇｀)oﾜｸﾃｶしながら、待ってるよ〜ん"
nc1513b5fff45e,ndfece4ee3222,3a25989705d811d276a669c386e1263a,まなつ/突出マイノリティ列伝,tosshutsu_m,https://assets.st-note.com/production/uploads/images/264868611/profile_9225f9d9e977f638179f2afb9ae1a84f.png?fit=bounds&format=jpeg&quality=85&width=330,2026-04-24T07:25:52.209+09:00,"途中にヒトタラヲさんの企画紹介が挟まれているところが、ユニーク！

ここでもまた1つ、はんくさんの人間的魅力に触れてしまいました(ﾉ´∀｀*)"
ncedee28ecfaad,ndfece4ee3222,32a3d5ec7b1b7751c0635f2e47ea2b11,あん｜noteと遊ぶ,aging_gracefully,https://assets.st-note.com/production/uploads/images/238258843/profile_52f43522d9e7e75a12acd9d6da59035c.png?fit=bounds&format=jpeg&quality=85&width=330,2026-04-23T18:15:45.498+09:00,"はんくさん💫
YouTuberはんくさんが素晴らしいのはもちろんだけど、自叙伝も読み応え抜群でいいですね🫶"
ncb43665a39e72,ndfece4ee3222,3e6fd263d73c4a43d84b61f816062c4f,かっぱの庵,leal_oriole8107,https://assets.st-note.com/production/uploads/images/169525688/profile_3908df5d317e1d614be9864701a72351.jpg?fit=bounds&format=jpeg&quality=85&width=330,2026-04-23T15:42:24.177+09:00,"私もこのところ、noteの方々を見習って、ちょっと暴露系（人によっては怖がりそうな）話題と本音を綴り始めておりましたが…
つくづく思ったけども、こういうSNS空間では〈自己開示〉をしないと、始まらないんだな…ということでした。😅
相手によっては、ヒクかもしれないし、逃げられちゃうかも？しれないけど、
それ以上に、今までよりもさらに親密感で繋がれる方々も現れるし、深まってゆくんだな〜と。

それにしても、はんくさんのこの「記憶力」…臨場感のある表現力、すごい能力だと思います。
人生史そのものが、一つの作品？ってぐらい、ドラマの登場人物みたいに面白いですね〜。😆"
