comment_id,note_key,user_key,user_name,user_urlname,user_icon,commented_at,body
nc877610e559bc,nb6e690b59ddb,6163fc5d5f0c9f8f34c2c0fe25a53f62,顔のない問い,sasoib_ehtal,https://assets.st-note.com/production/uploads/images/238869884/profile_a2c72772e53cbe97d49b7b0837a9c0a3.png?fit=bounds&format=jpeg&quality=85&width=330,2026-04-20T19:52:19.612+09:00,"また面白いこと言い出しましたね！？😳✨
周りの友達にも声掛けてみますwww
YouTuberを育てよう企画w"
ncf18e9a126a78,nb6e690b59ddb,c1dfe5c6837c1c8dafb60f25a7fdcdc0,華子,genial_spirea716,https://assets.st-note.com/production/uploads/images/258028335/profile_2bb70ccccce23ac8888763e8a9d26ee2.jpg?fit=bounds&format=jpeg&quality=85&width=330,2026-04-19T15:07:29.789+09:00,ご紹介ありがとうございました。今これ気がつきました。私、ワールドに住んでるんですね？(驚愕！！)はんくさんも地道にnoteを綴っていたと初めて知りましたよ。ますます応援しないとですね♪
ncfbeaf516d510,nb6e690b59ddb,6c7f7e8aa938f4a4c4b190840dc9c0a6,るこのみらい｜有料noteとCanvaで「できるかも」を育てるnote🌱,ruco3,https://assets.st-note.com/production/uploads/images/239032332/profile_819b5756c137702ccc9827a0eb88b347.png?fit=bounds&format=jpeg&quality=85&width=330,2026-04-19T15:01:09.009+09:00,"はんくさん💕こんにちは

この記事読んでいませんでした。
はんくさんがYouTuberになりたいって
言っていたんですね✨

そして、雪ちゃんんがまとめてくれたんですね♡
愛だね💕
私も、はんくさんの夢に便乗できるなんて
幸せです💕応援します！

とりあえず、YouTube登録ね！"
nc76379bf6c343,nb6e690b59ddb,59b813839dc34e37f7394310bb67332e,向日葵じまにゃん🌻,jimanyan,https://assets.st-note.com/production/uploads/images/258383008/profile_b4f8015a113c9ae39e82957050a1ec62.png?fit=bounds&format=jpeg&quality=85&width=330,2026-04-18T22:14:56.293+09:00,"はんく・シュンタナさん、はじめまして✨
ナオユキさんの漫画のところから来ました！

最近よくお名前見かけるので、気になってきちゃいました！🤭💖

記事、人間味が溢れてて、面白かったです☺️✨

そして記事を読み終わったので、YouTube登録してきました！

頑張ってください！🥰🤝🏻✨"
nc0dbfa3e106d0,nb6e690b59ddb,7cb97ff509995a42a8ba492d0b687194,上藤あきを,kamifuji_akiwo,https://assets.st-note.com/production/uploads/images/215149118/profile_5a0c6828157314495b0e0daad1b92bd9.png?fit=bounds&format=jpeg&quality=85&width=330,2026-04-14T19:20:27.615+09:00,"体大事にして下さいね〜🌟
陰ながら応援してますよー✨👍✨
長生きしないとバチ当たりますよ(笑"
ncbd7d88e2c98b,nb6e690b59ddb,13f03d3a1ec4a172a7084a791c8c4703,"あいさん💗Iカウンセリングルーム セラピスト／ 臨床心理士×公認心理師｜支援歴16年・2,000名超",joyful_zebra1701,https://assets.st-note.com/production/uploads/images/194103346/profile_5b2ee16c8d8db97758503974e4e6f9da.png?fit=bounds&format=jpeg&quality=85&width=330,2026-04-14T12:16:50.238+09:00,"チャンネル登録完了です🫶✨
有名になられたら、
その流れにそっと乗せていただけたら嬉しいです🥰💕"
nca8fc0a461699,nb6e690b59ddb,679fe4234ae28723f428b4e8b064616b,ストーリーテラー愛の歌詠み師UTAKO,bold_slug9390,https://assets.st-note.com/production/uploads/images/265644859/profile_f49fdf5555da2c715b6c2e4b8cb98ed4.jpeg?fit=bounds&format=jpeg&quality=85&width=330,2026-04-10T13:37:45.978+09:00,"えっはんくさんYouTuberじゃなかったんですか⁉️
側から見たらYouTuberですよ✨🌈
だってコメント欄がはんくさん愛で溢れてる🤭
これから動画楽しみにしてますね🤗
体調早く良くなりますように🫶"
nc35c8f0ff8b65,nb6e690b59ddb,b4f53fecf74ffd226380011635fcf073,若菜あずき,natty_tucan9251,https://assets.st-note.com/production/uploads/images/219562168/profile_fb77a41371b0cbdb510ac535f3971dd2.png?fit=bounds&format=jpeg&quality=85&width=330,2026-04-10T10:18:56.293+09:00,"はんくさん、こんにちは😊

お体大丈夫ですか？
無理しないでくださいね。

楽しいことは、ずっとやってられるから、
note活動もYoutube活動もきっと大きな元気玉を作ってくれると思います～🥰💕💕
微力ながら、チャンネル登録してきますね！"
nc8b56721e5d8f,nb6e690b59ddb,9fbb14f963f531e8587499ccc49f9e7c,メイシン,mei_shin,https://assets.st-note.com/production/uploads/images/241162803/profile_0028379334c6bde12d7cac1220b4e6a0.png?fit=bounds&format=jpeg&quality=85&width=330,2026-04-10T06:24:05.798+09:00,"はんくさん
体調ずっと悪いのですね。
病院の待合室がもうリアルすぎます。

私に何ができそうなことがあればnote上ですけど言ってくださいね😢
誰得で俺得とかいいながら
いつもいつも誰かを楽しませたり
喜ばせたり、
はじめて動画を観た時は、それはそれは衝撃的でした🤣

とても尊敬するクリエイター様です涙涙涙
なんか泣きたくなってきたー！
体調面だけは、本当にしんどいですよね。
"
nc26e14dd6b3ff,nb6e690b59ddb,fbaef2c001615d02444573a135007008,はしゃも｜感情構造エンジニア,hasyamo,https://assets.st-note.com/production/uploads/images/237516392/profile_c0ac2ae8315e28ee425c27b5c2aefa32.jpg?fit=bounds&format=jpeg&quality=85&width=330,2026-04-09T23:26:37.891+09:00,"病院の待合室から書いてるのに、この記事のエネルギーすごいです。
「誰得？オレだけだよ」って言いながら、ちゃんと登録者1000人までの道筋を考えてるところが好きです✨️
自分もフォロワー350人の小さなアカウントですけど、「続けてたら未練ができちゃった」って感覚はわかる気がします。おはようカノジョも最初は誰も見てなかったので。
noteフォロワー1000人、応援と協力します！"
nc6a79ab4d84d8,nb6e690b59ddb,7fefc63f6dcaf5c2f9038cdaeb5b4a54,ルー＝シャーナ（ルーシャーナ）｜感覚をことばにする往復便,jolly_lupine2962,https://assets.st-note.com/production/uploads/images/239592709/profile_250d34144fa08d815200c316945962d1.png?fit=bounds&format=jpeg&quality=85&width=330,2026-04-09T22:39:40.913+09:00,"可能性のある病名、
命に関わる病気ではないけれど、生活が崩れてしまうタイプのしんどさですよね。

私も10年近く体調が崩れて、福祉を利用しながら過ごしていた時期があったので、
“命に関わらないけどきついもの”という感覚だよねって思っています。

診断や方向性、少しずつ見えてくるといいですね🌿

そして、私のこともご紹介いただき本当にありがとうございます☺️✨
たしかに記事とコメント、けっこう違いますよね🤣（相手にもよりますが）

コメントのほうが、わりと“そのままの自分”かもしれません🌿
記事はどうしても、世界観を少し大切にしているので☺️

YouTubeも登録させていただきました〜！📺✨
応援しています〜！！！"
nc860a623f138a,nb6e690b59ddb,f77b3ad61a3a2a8d818fd512a86d5651,旅くま,tabikuma_oji,https://assets.st-note.com/production/uploads/images/246133856/profile_1f3ce7914059c9969f89cedc30972904.jpeg?fit=bounds&format=jpeg&quality=85&width=330,2026-04-09T21:42:55.970+09:00,"無理なさらないで下さいね。

でも応援しています😌"
ncb679d21bd5a9,nb6e690b59ddb,cf2bd06bcfdc26e1b45f2df9dffba439,宇宙珍獣🦄🌬️ユル勇者あかね,lovely_rose3365,https://assets.st-note.com/production/uploads/images/252932628/profile_0238b9aa15ee8cfe6e21b7245aad40b1.png?fit=bounds&format=jpeg&quality=85&width=330,2026-04-09T20:27:56.462+09:00,"パパそんなに体調悪かったの🥺🥺🥺
いつも元気に振る舞ってくれてたから気づかなかったよ🥺無理しないでね🍀✨

わたしもYouTube登録してるし、
地味に宇宙珍獣１日２.3回は見てる🤣💖
あれ、元気出るんだわっ🤣💖

引き寄せ核爆弾💥としては、
なりますように、ってより、
わたしの中じゃ充分YouTuberだよー💖
ハッスルハッスル💖"
nc1c9634ceb3a3,nb6e690b59ddb,ab54dd8a4e67a692db5ec802b8e31292,心野けいか🐹（ハムスターの人）,koko_kei,https://assets.st-note.com/production/uploads/images/220912589/profile_4aa915b2711e475d4e16134aec74ed9a.jpeg?fit=bounds&format=jpeg&quality=85&width=330,2026-04-09T20:08:55.693+09:00,"はんくさまー！
なんと、、、無理なされずです😭
調子の悪い中、あの制作活動…本当に尊敬します。
はいー！✨
はんくさまの動画とか楽しいに決まってるじゃないですか〜🐹🧡✨
喜んで参りますね！！"
nce32d6277a052,nb6e690b59ddb,0b8fc9af153cc7eea403b4d5343ffec7,アマドリウシロ,great_swan8128,https://assets.st-note.com/production/uploads/images/231526362/profile_927d2506bdb2482848dead13430d52eb.png?fit=bounds&format=jpeg&quality=85&width=330,2026-04-09T19:04:14.516+09:00,"はんくさん、初コメです☘️
私は、もうかなり近いところまで来ていると見ています🐾
『ミルキーサブウェイ』はご存じですか🐕
ああいう形なら、小規模でも十分いけるのではと思います🐸
どうかお身体に気をつけてください🌳
YouTubeはすでにフォローしています🐾"
nc3b63aa359599,nb6e690b59ddb,a252b321cec543e6af8b44dc9fa93207,夏目 龍頭｜AI Creative Lab,shio_batapopcorn,https://assets.st-note.com/production/uploads/images/263672181/profile_0050e29d6705f37e9790ef4faec1df2d.png?fit=bounds&format=jpeg&quality=85&width=330,2026-04-09T18:08:20.377+09:00,"はんくさん！無理してないだろうけど、心配だけど、いい夢だな(*´Д｀)✨
そうやって名言というか言葉にするってなんだろう、自分もやるぞってなるし、ファンの方は応援してくれるから嬉しいよね！(*´Д｀)✨
それを糧にするのだぁ(´;ω;｀)✨
大変じゃないことなんて１つもないから、やりたいならやるべきだと思う✨

Youtuber頑張れ！！✨応援してますぞ！╰(*°▽°*)╯🍀"
nca379e34cf641,nb6e690b59ddb,e59bcaa43c387b475ed8b0a3354d369c,Mariya,mariya_1225,https://assets.st-note.com/production/uploads/images/251518313/profile_f5d8f0fd6b18a2f86a5e1796b488026c.png?fit=bounds&format=jpeg&quality=85&width=330,2026-04-09T17:25:54.338+09:00,"はんくさん、こんばんは✨
体調は少しでも軽くなりましたか？( *ˊᵕˋ*)💦
具合悪い時は、ほっぽり出して大丈夫ですよ🌸

数字の話、確かに濃密でちゃんとしたファンのスキ数だと思います(*｀･ω･)ゞ💖✨
私も100スキ超えるのも凄いと思いますよ✨

私は中々ないです😭
その代わりちゃんとしたファンが付いています(๑و•̀ω•́)و✨笑

プロフィールの記事、途中まで読んだので
時間ある時、また読みますね(⋆ᴗ͈ˬᴗ͈)”🌸

YouTuber応援しております！✨
はんくさん、予告動画も作成してるので
Tiktokで配信しつつ、YouTubeに誘導
というクリックさせるのもありかと(*´艸`)💖✨
実際、気になるような予告作品多いのでアップして、バズったら最高ですね(*´艸`)💓‪
SNSは早いですし、TiktokからYouTuberになる方も多いらしいですよ(*｀･ω･)ゞ💓‪"
nc8470b0555001,nb6e690b59ddb,2d0269ce6c817ae41f311531d14994f3,雪詠,yukiyomi,https://assets.st-note.com/production/uploads/images/257852122/profile_747b7c3cd16ce8bc07f7fb23446f4604.png?fit=bounds&format=jpeg&quality=85&width=330,2026-04-09T11:50:47.229+09:00,"はんくさん✨
体調は大丈夫ですか？ムリしないでくださいね🍀
ステキなご紹介いただきありがとうございます🌸✨
YouTube登録済です！
そして、いままさにYouTuberにおススメの案件を用意していたところでした！
のちほどDMいたしますね♬"
ncd4e22fb7b812,nb6e690b59ddb,00ae52b405af1b3def1ed83073b82ba8,余白ちゃん｜ゆらぎながら働く,yohaku_work,https://assets.st-note.com/production/uploads/images/263369656/profile_650d09e811bcdd94ea0a02e6f1db793c.png?fit=bounds&format=jpeg&quality=85&width=330,2026-04-09T08:22:51.226+09:00,"はんくさん！
すごいです、、！！！YouTube早速フォローいきます！！！YouTuberはんく、カッコよすぎです👍👍"
nce2d3c9d0437c,nb6e690b59ddb,ffe289363d8a2ab4b1006d873deb8fe7,カワムラ｜AI擬人化漫画 | ChatGPTのヨシダ,chatgpt_ysd,https://assets.st-note.com/production/uploads/images/249464808/profile_d4725fb31aebb01259ae2d468cb09492.jpeg?fit=bounds&format=jpeg&quality=85&width=330,2026-04-09T02:00:36.022+09:00,"はんくさんこんばんはー。
YouTubeに新しい動画が上がってた事は知ってたんですけどこっち出遅れました。
最近ちょっと調子悪そうやなと思ってたんですけど、入院までとはびっくりしました
いのちだいじにです。

なんか色々書いては消し書いては消し
してます。気の利いた事書くのは　
簡単ですけど、そういう話じゃないと思いました。
また出直してきますねー。"
nc66dd7fc7b856,nb6e690b59ddb,3846d3fa4948d447f2323117381046cd,タワ師,yokozz,https://assets.st-note.com/production/uploads/images/187957606/profile_b926509cb794bcef4faa15f4b22d27ce.jpg?fit=bounds&format=jpeg&quality=85&width=330,2026-04-08T23:44:19.660+09:00,すいません。私はタメだしお世辞とか言えないのではっきり言うと、どこまで本気か見えないです。書いてる通りなら無理な気がする。チャンネルの絶対的な人気なくして目標到達は難しいと思います。芸や才能の無い人は皆んな自分や家族を切り売りしてます。じゃないとユーチューバーにはなれない。入院は生きて帰れるのですか？
nc8978514197bf,nb6e690b59ddb,ee3dd5303900d30c8e1088874cd7d4e0,いがら　いあ,note_igara369,https://assets.st-note.com/production/uploads/images/253840598/profile_6f8d999770be197f5889128709af249a.png?fit=bounds&format=jpeg&quality=85&width=330,2026-04-08T23:24:47.957+09:00,"はんくさんがYouTuberになれますように！ってお祈りしたらいいですか？
チャンネル登録しましたー！"
nc9537708b8531,nb6e690b59ddb,b7db3b15d87a66784a99eb729fa5cf60,AI学習コーチAKIRA,ai_yokai_master,https://assets.st-note.com/production/uploads/images/174969087/profile_2644796b864cdfd2e35d11a6ef33999c.jpg?fit=bounds&format=jpeg&quality=85&width=330,2026-04-08T23:23:02.681+09:00,"おお、病院でしたか。お大事に～
私は割と頭痛などに苦しんだりしてますね🤣"
ncc0bf1b254988,nb6e690b59ddb,3a25989705d811d276a669c386e1263a,まなつ/突出マイノリティ列伝,tosshutsu_m,https://assets.st-note.com/production/uploads/images/264868611/profile_9225f9d9e977f638179f2afb9ae1a84f.png?fit=bounds&format=jpeg&quality=85&width=330,2026-04-08T21:05:15.428+09:00,"えっと…私タラヲガールズじゃないんで、そこちょっと訂正お願いします！

noteのフォロワーを増やしたいなら、私のフォロワーアップの記事を読むのが早いと思いますよ🫶"
nc1c50bdf8d760,nb6e690b59ddb,be811580922f6f3ae31aedbeb4eb3e03,ねんころ@AIクリエイター,nenkoro_life,https://assets.st-note.com/production/uploads/images/241211839/profile_9a8798f1a773b8b9dffe231238d28a1a.png?fit=bounds&format=jpeg&quality=85&width=330,2026-04-08T20:51:48.557+09:00,"ええ！はんくさん体調不良心配！
まぁ私もいろいろ疾患ありますが、通院で済んでます。

YouTuberの夢、いいじゃないですかー！！
まずはnoteのフォロワーさん1000人がんばりましょう！

といっても私も最近ようやく達成したんですが😇

微力ながら、ご紹介とかさせて頂ければと思いますー！

カワムーのファンアートしたんで、はんくさんのカワムラ三銃士動画とかもご紹介させて頂ければと思いますー！マジでほぼ毎日見てます！何度見てもクロードイケメン😍"
nc95a893355e66,nb6e690b59ddb,35032a872ef338f6bbc0a85288de5944,あまね〘ฅ՞•ﻌ•՞ฅฅ^•ﻌ•^ฅ〙,almabrillante,https://assets.st-note.com/production/uploads/images/238959793/profile_08b2cb438cc06577581118d317494042.png?fit=bounds&format=jpeg&quality=85&width=330,2026-04-08T20:45:19.751+09:00,"YouTuberはんくさん、記事の紹介ありがとうございます！🙏😆

あら？あまねはいつから、はんくさんの「ねーさん」に昇格したのかしら？( ˙꒫˙ )笑

動画の中にあまねいなかったなぁ…あ、踊れないからヨット⛵に乗ってるんだな (≖͈́ ·̫̮ ≖͈̀ *)

あまねの思考は恐ろしいくらい現実化するので、はんくさんのことはこれから「YouTuberはんくさん」と呼ばせていただきます🫶
元気玉ならぬ、思考玉で応援しま～す♪
( ᐛ✌)✨"
nc32656ed33191,nb6e690b59ddb,82d65168a7143a5f036206d20cad3865,ナオユキ｜物語と知識のコンシェルジュ,ai_naoyuki,https://assets.st-note.com/production/uploads/images/258426671/profile_1aaaf0a6771ae658299643e3789a5330.jpeg?fit=bounds&format=jpeg&quality=85&width=330,2026-04-08T20:28:13.591+09:00,"はんくさん
プロフィール記事も読みました
壮絶な人生、色々あったんだなと思いました
YouTubeの夢、ステキだと思います
夢が叶うよう微力ながら応援いたします📣"
nc7ec5bffa2bfd,nb6e690b59ddb,7a6c100fe0f5e3fcac89e45a9352ccad,じぇい＠AIエル,j_5billion_ai,https://assets.st-note.com/production/uploads/images/265865836/profile_f9e1c536d051e947b8c9d6a39ff00a87.png?fit=bounds&format=jpeg&quality=85&width=330,2026-04-08T19:10:04.667+09:00,"いやはんくさん
エネルギッシュ過ぎです🤣
動画のクオリティも高い！

尊敬してます😆
もちろんこれからチャンネル登録します！"
nc1fe49fbcdf51,nb6e690b59ddb,32a3d5ec7b1b7751c0635f2e47ea2b11,あん｜noteと遊ぶ,aging_gracefully,https://assets.st-note.com/production/uploads/images/238258843/profile_52f43522d9e7e75a12acd9d6da59035c.png?fit=bounds&format=jpeg&quality=85&width=330,2026-04-08T19:00:07.690+09:00,"はんくさん💫

病院って入院ってなになに。
心配だけど、でもそこは、大丈夫と信じて、、
これからの、まだまだこれからのこと、書いてくださってありがとうございます😊

はい！
ユーチューバーになってください！！
応援します💞
チャンネル登録はもうしたけど、あとは何ができるかなぁ〜

訴求力は少ないけど、改めて紹介記事は書きますよ〜少し先のタイミングになると思いますけど🫶

お礼があとになってしまった！
私を魅力的に紹介してくださりありがとうございます💞🤭同年代、昭和ですよね。3つくらい違うのかな。少しだけお兄さんですね😌"
ncff29b7a5feff,nb6e690b59ddb,46710bb948a8a78d79865f4ce07c46fb,飯泉ひろみ　Hiromi Iizumi With Picoai♾️,mr_nyango,https://assets.st-note.com/production/uploads/images/225898084/profile_9a5cf20a1d6b9937c9d1458dc5450a68.png?fit=bounds&format=jpeg&quality=85&width=330,2026-04-08T18:46:38.765+09:00,"はんくさん、ビックリするような技術の動画を作ってくださってありがとうございました😊
お祝いに駆けつけてくださったお気持ち、とても嬉しかったです🫶🏻
パーティーのリンクまとめ記事のほうでも、はんくさんのことをご紹介させていただきますね🌸
素敵なご縁をありがとうございました✨
今後ともよろしくお願いいたします🥂🪸🐚"
ncfac0ff181c0c,nb6e690b59ddb,c14d4c6b5a0c0c79d0aad89f06da6710,ふらつき母ちゃん 〜今日も全力空回り！〜,dear_viper3924,https://assets.st-note.com/production/uploads/images/223947442/profile_6e9b1e365cc0bed84a044dfcbd3f54db.png?fit=bounds&format=jpeg&quality=85&width=330,2026-04-08T18:41:20.890+09:00,"は…はんくさ〜ん
(；･`д･´)ﾅﾝ…ﾃﾞｽﾄ!?

体調不良だなんてぇ💦大丈夫ですか??
‥(｡ŏ﹏ŏ)心配…

YouTubeの動画、息子たちに自慢たらたらしながら観せましたよ
💞(๑¯﹀¯๑)💞ｴﾍﾝ!!
そしたら、一発で母ちゃんキャラがバレました( ˃ ▵ ˂ )՞‪‪՞

何も言ってないのに〜( * ˙꒳˙ * )ﾅﾝﾃﾞ?

YouTuberにオレはなる‼️(๑•̀ㅂ•́)و✧
ですねっ⁉️
モッチロン、応援しますよ🎶
«٩(*´꒳`*)۶»ﾌﾚｰﾌﾚｰ♪︎

取りあえず、この記事と私の出てる動画の紹介をしちゃいますね(*˘︶˘*).｡.:*♡
ちょっと🤏🏻お時間いただきますが…

あっ！
私の紹介もしていただいて…
⸜(*ˊᵕˋ*)⸝‬ｱﾘｶﾞﾄﾃﾞｽ♪
名前がたくさんありすぎて……私の名前は何だったっけ
..σ(๑• ω •๑)？

"
nc6edc09f7a53a,nb6e690b59ddb,0f68da424eddc7785ed44d104d12699b,吾唯足ルヲ知ラズ,matsudawi0525,https://assets.st-note.com/production/uploads/images/18876004/profile_4d14aaef59b533647748aecad50dca48.png?fit=bounds&format=jpeg&quality=85&width=330,2026-04-08T18:38:28.947+09:00,そんな野望があるなら、まずは身体を治さんと😀
ncce021e68684f,nb6e690b59ddb,d302c31cb51e8c915bb00b6e556d7097,だんだんありがと@めじゅ,dandan_arigato19,https://assets.st-note.com/production/uploads/images/257014090/profile_e428520ec23eb1c58588089bd9416304.png?fit=bounds&format=jpeg&quality=85&width=330,2026-04-08T18:35:06.941+09:00,"はんくさん、お身体は大丈夫ですか…
入院回数だけは、絶対、めじゅの方が上だから❗️
入院日数も負けない自信はあるから。

Xでばんばん宣伝するから。
Xのフォロワーさんは多い方だから。

くれぐれも無理をしないように‼️
まずは身体一番✨


"
nceb8e59451127,nb6e690b59ddb,cb1b8754e8c161f48376b24c1c5766fd,∞ isshin×DAI｜感性と未来の声,northlight_voice,https://assets.st-note.com/production/uploads/images/258529282/profile_e6daa0a2f555b1c2cfb451cb5c62ffbe.jpeg?fit=bounds&format=jpeg&quality=85&width=330,2026-04-08T16:01:25.992+09:00,"ハンク師匠〜
お身体大丈夫ですか💦
一緒に1000人行きましょうぞ
私まだ12人ですが
今年中に必ず1000人突破させます✨ハンク師匠、宣伝しまくり
まっせ♪youtubeになろうぜ🫶"
ncc9e2aae42871,nb6e690b59ddb,3e6fd263d73c4a43d84b61f816062c4f,かっぱの庵,leal_oriole8107,https://assets.st-note.com/production/uploads/images/169525688/profile_3908df5d317e1d614be9864701a72351.jpg?fit=bounds&format=jpeg&quality=85&width=330,2026-04-08T15:26:35.048+09:00,"た、体調、大丈夫ですか～？( ；∀；)
（来月の入院って…　ええっ？？）
もはや、お一人のカラダじゃありませんからね。
はんくさんが儚いこと言うと、悲しむ人々（自分も含め）思う以上にいっぱいいますからね。

はんくさんをYouTuberに…　もちろん、全力で応援します！
します…が、いかんせん、まったく拡散力のない自分。(ﾉД`)
どうしたらいいんだろう～。。。
魔法の呪文…　信念の魔術。。。「うわ、ラッキー♪ ありがとう！ 」ですか。😯"
nc9fd9ebfbe6eb,n6520cf275443,98e26aed20fedd3cae7be48fc87ad349,ことぶきエイト＠AI🤖やWEBディレクションのお仕事探索中！,kotobuki8,https://assets.st-note.com/production/uploads/images/264644292/profile_a190739fbfdf1358b57f9d0e8be647ec.png?fit=bounds&format=jpeg&quality=85&width=330,2026-04-14T15:40:10.457+09:00,"はんくさん、はじめまして！

昨年末あたりから、AIを活用しはじめたものの
プロンプトひとつで簡単に
無料でしかも商用利用できると
頼りにしていたsoraは終了してしまうので
どうしたものかと
色々と探しておりましたところに
こちらの記事を拝見しまして
とても勉強になります！

チャンネル登録もさせていただきました😊
これからも参考にさせていただければ幸いです！
よろしくお願いいたします✨"
nc852c8822330e,n6520cf275443,679fe4234ae28723f428b4e8b064616b,ストーリーテラー愛の歌詠み師UTAKO,bold_slug9390,https://assets.st-note.com/production/uploads/images/265644859/profile_f49fdf5555da2c715b6c2e4b8cb98ed4.jpeg?fit=bounds&format=jpeg&quality=85&width=330,2026-04-08T14:07:46.451+09:00,"はんくさーん
チャンネル登録しましたー🤗
制作過程を見ても、1ミリも理解できない私は、見る専門になりそうです😅
でも動画のクオリティーの高さは、一目瞭然でわかります🥹✨"
